doctor_id,source_file,profile_url,nice_id,name,specialty,medical_code,verified,followers_count,reviews_count,rating_percent,rating_score_5,biography,office_count,comments_count_in_file,selected_source_file,all_source_files,source_files_count
130269,مغز_و_اعصاب_doctor_418.json,https://nobat.ir/drrafizadeh,drrafizadeh,دکتر شبنم رفیع زاده,متخصص مغز و اعصاب و ستون فقرات,متخصصشماره نظام: ۱۰۳۳۷۶,False,,411.0,94.0,4.7,"تخصص مغز و اعصاب و ستون فقرات و عضلات، دارای مدرک تکمیلی اختلالات حافظه از دانشگاه علوم پزشکی تهران رتبه برتر دوره تخصص مغز و اعصاب وب سایت: drrafizadeh.ir dr-rafizadeh.ir ++ کلینیک های دکتر رفیع زاده: ++ کلینیک مغز و اعصاب دکتر رفیع زاده ++ کلینیک ستون فقرات و دیسک کمر و گردن دکتر رفیع زاده ++ کلینیک درمان غیر جراحی دردهای مزمن نظیر سردرد و میگرن و ++ دیسک کمر و گردن ++ کلینیک طب سوزنی و طب فیزیکی و توانبخشی دکتر رفیع زاده ++ کلینیک نوار عصب و عضله دکتر رفیع زاده الدکتور شبنم رفیع زاده اخصائی امراض المخ والاعصاب، اخصائی امراض الدماغ و الاعصاب, الجمله العصبیه تشخیص و درمان: سردرد، سرگیجه، تشنج، سکته های مغزی، MS، اختلالات حرکتی، اختلالات حافظه و آلزایمر، اختلالات خواب، اختلالات بینایی و دوبینی، مشکلات تعادل، کمردرد، اختلالات عصبی و عضلانی انجام تست های تخصصی اختلالات حافظه (دارای مدرک تکمیلی اختلالات حافظه از دانشگاه تهران) نوار مغز و نوار عصب و عضله دوره ها و گواهینامه های تخصصی: -مدرک تکمیلی اختلالات حافظه از دانشگاه تهران سال 97. - پیشگیری و تشخیص زودرس اختلالات شناخت و حافظه در سالمندان، دانشگاه علوم پزشکی تهران، سال 97. -آموزش الکتروآنسفالوگرام، بیمارستان خاتم الانبیا، سال 96 . -تصویربرداری مغز و ستون فقرات، دانشگاه علوم پزشکی تبریز، سال 93 -درمان و تشخیص سکته های مغزی با علت نامعلوم، انجمن آترواسکلروز ایران، سال 95. -کارگاه اختلالات خواب، پژوهشکده علوم شناختی دانشگاه علوم پزشکی شهید بهشتی، دکتر حبیب الله خزایی و همکاران، سال 95. سوابق کاری: 1- متخصص مغز و اعصاب در بیمارستان غیاثی تهران از سال 93 تا کنون 2- متخصص مغز و اعصاب در بیمارستان سوم شعبان تهران از سال 97 تا کنون 3- متخصص مغز و اعصاب در بیمارستان ضیائیان تهران از سال 92 تا 96 4- متخصص مغز و اعصاب در بیمارستان آزادی تهران 95 تا 97 5-متخصص مغز و اعصاب در بیمارستان شهریار تهران سال 97 6- دادیار نظام پزشکی در نظام پزشکی ابهر 7- متخصص مغز و اعصاب در بیمارستان امدادی ابهر از سال 90 تا 93 8- پزشک عمومی در شبکه بهداشت مریوان از سال 83 تا 86 الدکتور شبنم رفیع زاده اخصائی امراض المخ والاعصاب، اخصائی امراض الدماغ و الاعصاب, الجمله العصبیه مجال النشاط: فوق اخصائی فی جراحه الاعصاب تخطیط امواج الدماغ تخطیط کهربائیه العضل تخطیط صدی الدماغ خدمات اعاده التاهیل تخطیط صدی الدماغ و TccD EmG/NCv VEp فوق تخصص مغز و اعصاب بزرگسالان بهترین متخصص مغز و اعصاب در تهران متخصص مغز و اعصاب ستارخان متخصص مغز و اعصاب ستارخان متخصص مغز و اعصاب فلکه صادقیه پروفسور مغز و اعصاب در تهران بهترین دکتر مغز و اعصاب در ایران کیست دکتر پنجه طلا جراح مغز و اعصاب بهترین جراح مغز و اعصاب تهران جراح مغز و اعصاب زن در ایران جراح مغز و اعصاب خوب در تهران پروفسور بابک باباپور - جراح مغز و اعصاب و ستون فقرات استان تهران، تهران پروفسور محسن مهاجر بهترین متخصص مغز و اعصاب",2,262,مغز_و_اعصاب_doctor_418.json,مغز_و_اعصاب_doctor_418.json,1
130745,زنان_و_زایمان_doctor_11.json,https://nobat.ir/doctor/%D8%AF%DA%A9%D8%AA%D8%B1-%DA%AF%DB%8C%D8%AA%DB%8C-%D8%B3%DB%8C%D8%AF%D9%82%DB%8C%D8%A7%D8%B3%DB%8C-%D8%AA%D9%87%D8%B1%D8%A7%D9%86/dr-7273/vs-1,7273,دکتر گیتی سیدقیاسی,متخصص زنان و زایمان,متخصصشماره نظام: ۱۲۹۶۴۷,False,,220.0,86.0,4.3,جراح ومتخصص زنان و زایمان و نازایی و لاپاراسکوپی پیشرفته و زیبایی انجام عمل جراحی vnotes (جراحی لاپاراسکوپی از طریق واژن بدون هیچگونه برش روی شکم) سایت Drgitighiasi.com بیمارستانهای طرف قرارداد: هتل بیمارستان گاندی، عرفان نیایش، مهر، آسیا، بانک ملی، مرکز ناباروری ابن سینا، مفرح، بازرگانان جراحیهای زیبایی زنان با لیزر انجام کلیه جراحی های زنانه به روش لاپاراسکوپی (خارج کردن رحم، کیست تخمدان، فیبروم) انجام کلیه جراحیهای زنان و زیباییهای زنان تزریق چربی و ژل و لیفت سزارین درمان ناباروری درمان کیستهای تخمدان و اندومتریوز و بیماریهای رحمی با لاپاروسکوپی پاپ اسمیر .کولپوسکپی و ـ انجام عملهای زیبایی زنان: لبیا پلاستی و جوانسازی و تنگ کردن و سفید کردن با لیزر، کربوکسی تراپی روشن سازی ناحیه پرینه با انواع روش ها کربوکسی تراپی و لیزر درمان زگیل تناسلی به بهترین روش تشخیص مراحل پیش سرطانی کولپوسکوپی درمان انواع بی نظمی های قاعدگی و تنبلی تخمدان درمان عفونت های مقاوم واژینال با دارو و لیزر درمان استریاها و برطرف کردن آن رفع مشکلات ادراری و مراقبت دوران یائسگی رفع بی اختیاری ادراری درمان خونریزی های غیر طبیعی مراقبتهای دوره ای و تستهای غربالگری سلامت زنان,1,143,زنان_و_زایمان_doctor_11.json,زنان_و_زایمان_doctor_11.json,1
130755,ارتوپدی_doctor_181.json,https://nobat.ir/drmehrpour,drmehrpour,دکتر سعیدرضا مهرپور,متخصص ارتوپدی و جراح ستون فقرات,فلوشیپشماره نظام: ۹۷۱۷۲,False,,884.0,96.0,4.8,,1,263,ارتوپدی_doctor_181.json,ارتوپدی_doctor_181.json,1
130762,کلیه_و_مجاری_ادراری_(اورولوژی)_doctor_509.json,https://nobat.ir/najmidr,najmidr,دکتر بهزاد نجمی,متخصص جراحی کلیه ، مجاری ادراری و تناسلی,متخصصشماره نظام: ۵۴۲۴۴,False,,190.0,90.0,4.5,,2,125,کلیه_و_مجاری_ادراری_(اورولوژی)_doctor_509.json,کلیه_و_مجاری_ادراری_(اورولوژی)_doctor_509.json,1
131109,ارتوپدی_doctor_131.json,https://nobat.ir/7354,7354,دکتر روزبه تقوی,جراح ارتوپد و فلوشیپ جراحی دست-شانه ،ارنج,فلوشیپشماره نظام: ۱۱۶۶۹۲,False,,1029.0,90.0,4.5,دکتر روزبه تقوی، فوق تخصص جراحی شانه و دست، از جراحان برجسته ایران در حوزه ارتوپدی. فارغالتحصیل رشته پزشکی عمومی از دانشگاه علوم پزشکی. دوران رزیدنتی در بیمارستانهای حضرت رسول اکرم و شفا یحیاییان به مدت ۴ سال. اخذ بورد تخصصی جراحی استخوان و مفاصل در سال ۱۳۹۴. گذراندن دوره فوق تخصصی دست در بیمارستان شفا یحیاییان. دوره فوق تخصصی پیوند دست و انگشت در بیمارستان حضرت فاطمه زهرا در سال ۱۳۹۷. گذراندن دوره فلوشیپ جراحی دست در آلمان. بهترین جراح عمل جراحی سندروم تونل کارپال (چسبندگی عصب دست) و کیست های مچ دست متخصص جراحی اعصاب محیطی و میکروسرجری جراحی پارگی انواع تاندون، اعصاب و بافت ها در دست و شانه متخصص در جراحی شانه به روش لیزری یا آرتروسکوپی. تنها فوق تخصص دست در غرب تهران با مطب در تهران و کرج. ارائه خدمات پزشکی در زمینه دست و شانه با روشهای نوین و کمتهاجمی. امکان دریافت مشاوره و درمان در مطبهای تهران و کرج.,2,246,ارتوپدی_doctor_131.json,ارتوپدی_doctor_131.json,1
131196,زنان_و_زایمان_doctor_82.json,https://nobat.ir/drborzoo,drborzoo,دکتر لیلا برزو,متخصص زنان و زایمان,متخصصشماره نظام: ۶۰۶۱۷,False,,419.0,94.0,4.7,دارای بورد تخصصی دانشگاه جندی شاپور سابقه29سال کار پزشکی انجام کلیه عملهای زنان شامل زایمان طبیعی با بیدردی اپیدورالو .سزارین لاپاراسکوپی وهیستروسکوپی وکیست تخمدان و فیبروم رحم وعملهای زیبایی درمان بیماریهای زنان.؛عفونتها.زگیل انجام پاپ اسمیر انجام رایگان سونو شکمی و واژینال درمان کامل زگیل با پلاسما پن در یک جلسه درمان عفونتهای مکرر واژینال و زخم دهانه رحم با پلاسما قرداد با بیمارستانهای محب کوثر سوم شعبان .نجمیه. یاس سپید. مفرح. بازرگانان. پارسا. نور شهریار و امام خمینی شهریار,3,261,زنان_و_زایمان_doctor_82.json,زنان_و_زایمان_doctor_82.json,1
131273,ارتوپدی_doctor_168.json,https://nobat.ir/peymanj,peymanj,دکتر پیمان جاوید,متخصص ارتوپدی ( جراح استخوان و مفاصل ),متخصصشماره نظام: ۳۲۴۱۸,False,,356.0,86.0,4.3,"با شماره ۵۵۱۸۹۵۱۶ از ۴ بعد از ظهر تا ۹ شب می توانید نوبت مطب بگیرید.نوبت گیری بیمارستان پارس با شماره ۵۵۱۸۹۵۱۶ -۰۲۱از ۸ صبح تا ۴بعد از ظهر -جراحی لگن، زانو، دست، شانه، -ارتروسکوپی (جراحی بسته) زانو، منیسک و رباط صلیبی -شکستگی و دررفتگی استخوان و مفاصل - ستون فقرات (دیسک، تنگی کانال) -آرتروپلاستی (تعویض مفصل) زانوولگن - درمان های غیر جراحی, مشکلات ارتوپدی: شامل تزریق ژل، پی ار پی (PRP)، پرولوتراپی -مدیریت درد های حاد و مزمن",2,215,ارتوپدی_doctor_168.json,ارتوپدی_doctor_168.json,1
131615,کلیه_و_مجاری_ادراری_(اورولوژی)_doctor_550.json,https://nobat.ir/7434,7434,دکتر سیدیعقوب صهری,فلوشیپ سرطانهای دستگاه ادراری (کرایو تراپی در مطب),فلوشیپشماره نظام: ۹۹۶۹۲,False,,533.0,94.0,4.7,,2,248,کلیه_و_مجاری_ادراری_(اورولوژی)_doctor_550.json,کلیه_و_مجاری_ادراری_(اورولوژی)_doctor_550.json,1
169908,پوست_و_مو_doctor_314.json,https://nobat.ir/drzahraghodsi,drzahraghodsi,دکتر سیده زهرا قدسی,متخصص پوست و مو,متخصصشماره نظام: ۳۱۰۲۶,False,,173.0,96.0,4.8,خدمات تخصصی و فوق تخصصی پوست، مو و زیبایی: -تشخیص و درمان بیماری های زمینه ای و مزمن -اگزوزوم (صورت و مو) -لیزر کم توان -تزریق بوتاکس (صورت و زیربغل) -فیشال تخصصی -لیزر جوانسازی، کک و مک، اسکار و موهای زائد -پی آر پی (صورت و مو) -مزوتراپی و مزوژل -میکرونیدلینگ -میکرودرم,3,110,پوست_و_مو_doctor_314.json,پوست_و_مو_doctor_314.json,1
169917,پوست_و_مو_doctor_349.json,https://nobat.ir/wd8o,wd8o,دکتر محمد شیزرپور,متخصص پوست و مو,متخصصشماره نظام: ۶۷۳۰۹,False,,430.0,94.0,4.7,,1,246,پوست_و_مو_doctor_349.json,پوست_و_مو_doctor_349.json,1
173496,زنان_و_زایمان_doctor_33.json,https://nobat.ir/doctor/%D8%AF%DA%A9%D8%AA%D8%B1-%D9%86%D8%A7%D8%B2%DB%8C%D9%84%D8%A7-%D9%86%D9%88%D8%B1%DB%8C-%D8%AA%D9%87%D8%B1%D8%A7%D9%86/dr-dr.nazilanoori/vs-1,dr.nazilanoori,دکتر نازیلا نوری,متخصص زنان و زایمان,متخصصشماره نظام: ۴۷۲۱۳,False,,128.0,96.0,4.8,,1,86,زنان_و_زایمان_doctor_33.json,زنان_و_زایمان_doctor_33.json,1
173581,زنان_و_زایمان_doctor_86.json,https://nobat.ir/vd5b,vd5b,دکتر پروین همتی,متخصص زنان و زایمان,متخصصشماره نظام: ۳۸۴۶۵,False,,199.0,94.0,4.7,دارای بورد تخصصی رتبه اول تخصص کشور عضو انجمن جراحان ایران,3,138,زنان_و_زایمان_doctor_86.json,زنان_و_زایمان_doctor_86.json,1
173666,زنان_و_زایمان_doctor_48.json,https://nobat.ir/vdzm,vdzm,دکتر فرشته سادات جلالی,جراح و متخصص زنان و زایمان و نازایی,متخصصشماره نظام: ۷۴۲۸۴,False,,311.0,94.0,4.7,دکتر فرشته سادات جلالی هستم بیش از ۱۵ سال سابقه طبابت در رشته ی تخصصی زنان دارم و باصدها عمل جراحی موفق در زمینه های مختلف تخصصی رشته زنان و زایمان در خدمت شما بیماران و مراجعه کنندگان عزیز هستم. در زمینه جراحی های سزارین، لاپاراسکوپی، کلیه اعمال مرتبط با جراحی های زیبایی زنان و لابیاپلاستی و …سابقه ی موفقیت امیزی دارم و با امار بیش از نود درصد رضایت بیماران، تمام تلاشم را برای برطرف نمودن مشکلات بیمارانم به مار میگیرم.,1,174,زنان_و_زایمان_doctor_48.json,زنان_و_زایمان_doctor_48.json,1
178917,زنان_و_زایمان_doctor_59.json,https://nobat.ir/doctor/%D8%AF%DA%A9%D8%AA%D8%B1-%D9%BE%D8%B1%DB%8C%D8%B3%D8%A7-%D9%85%D9%82%D8%AA%D8%AF%D8%A7%DB%8C%DB%8C-%D8%AA%D9%87%D8%B1%D8%A7%D9%86/dr-pmoghtadaei/vs-1,pmoghtadaei,دکتر پریسا مقتدایی,متخصص زنان و زایمان ، نازایی,متخصصشماره نظام: ۶۶۲۵۵,False,,313.0,96.0,4.8,دکتر پریسا مقتدایی متخصص زنان وزایمان و پریناتالوژیست هستند. ایشان دارای گواهینامه سونوگرافی پیشرفته جنین از مرکز FMF انگلستان به شماره ۶۱۲۰۶ میباشند.عمده فعالیت ایشان در خصوص کنترل بارداریهای پرخطر و مادران با بیماریهای زمینه ای و سخت و جراحی های پیچیده در بارداری نظیر انواع چسبندگی های جفت میباشد. انواع سونوگرافی های جنین از قبیل غربالگریهای سه ماه اول (NT) ؛آنومالیهای سه ماهه دوم ؛ سونوگرافی داپلر ؛سونوگرافی های بررسی سلامت جنین در طی سه ماهه سوم ؛تستهای بررسی سلامت جنین نظیر آمنیوسنتز توسط ایشان قابل انجام است .مشاوره پیش از حاملگی در موارد مادران با سابقه بد حاملگی قبلی و مشاوره های درطی بارداری نیز از جمله فعالیتهای ایشان میباشد.لازم به ذکر است که از شروع پاندمی کوید تا کنون با کنترل و مشاوره بیش از ۵۰۰ مادر باردا مبتلا به کرونا و زایمان بیش از ۳۰۰ نفر از آنها پیشرو در کمک به پیشبرد اهداف سلامت مادران مبتلا به کرونا و جنین و نوزادان آنها هستند.,1,201,زنان_و_زایمان_doctor_59.json,زنان_و_زایمان_doctor_59.json,1
179929,ارتوپدی_doctor_151.json,https://nobat.ir/eenz,eenz,دکتر حمیدرضا اصلانی,فلوشیپ جراحی آرتروسکوپی,فلوشیپشماره نظام: ۲۹۵۲۶,False,,361.0,94.0,4.7,فلوشیپ جراحی آرتروسکوپی متخصص جراحی شانه و زانو از امریکا,1,225,ارتوپدی_doctor_151.json,ارتوپدی_doctor_151.json,1
180186,زنان_و_زایمان_doctor_42.json,https://nobat.ir/doctor/%D8%AF%DA%A9%D8%AA%D8%B1-%D9%81%D8%A7%D8%B7%D9%85%D9%87-%D9%85%D8%AD%D8%B1%D8%A7%D8%A8%DB%8C-%D8%AA%D9%87%D8%B1%D8%A7%D9%86/dr-ee48/vs-1,ee48,دکتر فاطمه محرابی,فلوشیپ ناباروری,فلوشیپشماره نظام: ۶۷۵۸۰,False,,207.0,90.0,4.5,,2,114,زنان_و_زایمان_doctor_42.json,زنان_و_زایمان_doctor_42.json,1
180889,کلیه_و_مجاری_ادراری_(اورولوژی)_doctor_538.json,https://nobat.ir/drvaryani.urology,drvaryani.urology,دکتر محسن وریانی,فلوشیپ جراحی درون بین کلیه و مجاری ادراری (اندویورولوژی),فلوشیپشماره نظام: ۹۴۳۲۲,False,,252.0,96.0,4.8,دکتر محسن وریانی هستم . ورودی مهر ۷۳ دانشگاه شهید بهشتی کنکور سراسری. ورودی مهر ۸۴ جراحی کلیه و مجاری ادراری دانشگاه تهران و ورودی مهر ۹۶ دانشگاه شهید بهشتی در مقطع فلوشیپ اندویورو لاپاروسکوپی.,1,162,کلیه_و_مجاری_ادراری_(اورولوژی)_doctor_538.json,کلیه_و_مجاری_ادراری_(اورولوژی)_doctor_538.json,1
181690,مغز_و_اعصاب_doctor_409.json,https://nobat.ir/vn1r,vn1r,دکتر بهروز عظیمی,متخصص مغز و اعصاب (نورولوژی),متخصصشماره نظام: ۳۸۳۱۳,False,,535.0,96.0,4.8,بورد تخصصی مغز و اعصاب از دانشگاه علوم پزشکی شهید بهشتی (۲۹ سال سابقه طبابت) برای موارد زیر فقط با شماره موبایل تماس گرفته شود نوبت ها فقط برای ویزیت میباشد. نوار مغزی __ نوار عصب وعضله__تزریق بوتاکس میگرن,1,267,مغز_و_اعصاب_doctor_409.json,مغز_و_اعصاب_doctor_409.json,1
182007,کلیه_و_مجاری_ادراری_(اورولوژی)_doctor_542.json,https://nobat.ir/v8er,v8er,دکتر منوچهر امیری,متخصص جراحی کلیه و مجاری ادراری ( اورولوژی ),متخصصشماره نظام: ۲۹۲۷۲,False,,35.0,94.0,4.7,,1,15,کلیه_و_مجاری_ادراری_(اورولوژی)_doctor_542.json,کلیه_و_مجاری_ادراری_(اورولوژی)_doctor_542.json,1
186565,مغز_و_اعصاب_doctor_463.json,https://nobat.ir/doctor/%D8%AF%DA%A9%D8%AA%D8%B1-%D9%86%D9%88%D8%B1%D8%A7%D9%84%D8%AF%DB%8C%D9%86-%D8%B5%D8%AF%D8%B1%D8%A7%D9%84%D8%A7%D8%B3%D9%84%D8%A7%D9%85%DB%8C-%D8%AA%D9%87%D8%B1%D8%A7%D9%86/dr-q5b7/vs-1,q5b7,دکتر نورالدین صدرالاسلامی,متخصص مغز و اعصاب (نورولوژی),متخصصشماره نظام: ۲۶۷۶۱,False,,107.0,94.0,4.7,عضو هیئت علمی دانشگاه علوم پزشکی با ۳۵ سال سابقه کاری، موسس بخش مغز و اعصاب، ریاست بیمارستان تخصصی و فوق تخصصی توحید (سنندج)، موسس و رئیس انجمن ام اس استان کردستان (سنندج),1,56,مغز_و_اعصاب_doctor_463.json,مغز_و_اعصاب_doctor_463.json,1
186837,زنان_و_زایمان_doctor_94.json,https://nobat.ir/g9vk,g9vk,دکتر بهناز عطارشاکری,متخصص زنان و زایمان - فلوشیپ نازایی,فلوشیپشماره نظام: ۶۵۸۸۰,False,,697.0,90.0,4.5,"متخصص زنان و زایمان. فلوشیپ نازایی از دانشگاه تهران، ivf, لاپاروسکوپی، رتبه برد تخصصی از دانشگاه تهران، سابقه کاری ۲۲ ساله",1,235,زنان_و_زایمان_doctor_94.json,زنان_و_زایمان_doctor_94.json,1
188603,مغز_و_اعصاب_doctor_457.json,https://nobat.ir/vl5v,vl5v,دکتر مهران شفیعی,متخصص مغز و اعصاب (نورولوژی),متخصصشماره نظام: ۷۴۶۶۱,False,,170.0,94.0,4.7,,3,114,مغز_و_اعصاب_doctor_457.json,مغز_و_اعصاب_doctor_457.json,1
190449,زنان_و_زایمان_doctor_70.json,https://nobat.ir/pqrq,pqrq,دکتر لیلا سلطانی,متخصص زنان و زایمان,متخصصشماره نظام: ۵۵۴۱۶,False,,151.0,94.0,4.7,,1,90,زنان_و_زایمان_doctor_70.json,زنان_و_زایمان_doctor_70.json,1
190486,زنان_و_زایمان_doctor_35.json,https://nobat.ir/doctor/%D8%AF%DA%A9%D8%AA%D8%B1-%D9%81%D8%B1%DB%8C%D8%A8%D8%A7-%D9%88%D9%81%D8%A7-%D8%AA%D9%87%D8%B1%D8%A7%D9%86/dr-pqvm/vs-1,pqvm,دکتر فریبا وفا,متخصص زنان و زایمان,متخصصشماره نظام: ۷۸۱۷۱,False,,68.0,86.0,4.3,دانش آموخته رشته تخصصی زنان و زایمان از دانشگاه تبریز دارای بورد تخصصی,1,40,زنان_و_زایمان_doctor_35.json,زنان_و_زایمان_doctor_35.json,1
190850,گوش_حلق_و_بینی_doctor_259.json,https://nobat.ir/7p9d,7p9d,دکتر رامین صابری نجفی,متخصص گوش و حلق و بینی,متخصصشماره نظام: ۷۰۷۸۱,False,,259.0,96.0,4.8,جراحی زیبایی صورت / بلفاروپلاستی /زیبایی بینی و تزریق بوتاکس و ژل,1,160,گوش_حلق_و_بینی_doctor_259.json,گوش_حلق_و_بینی_doctor_259.json,1
191069,مغز_و_اعصاب_doctor_456.json,https://nobat.ir/dr_afsounseddighi_neurosurgeon,dr_afsounseddighi_neurosurgeon,دکتر افسون صدیقی,متخصص جراحی مغز و اعصاب,متخصصشماره نظام: ۶۴۶۷۱,False,,270.0,94.0,4.7,,2,162,مغز_و_اعصاب_doctor_456.json,مغز_و_اعصاب_doctor_456.json,1
191138,ارتوپدی_doctor_156.json,https://nobat.ir/drbasiri,drbasiri,دکتر کیارش بصیری,متخصص جراحی استخوان و مفاصل (ارتوپدی),متخصصشماره نظام: ۷۰۵۲۸,False,,129.0,94.0,4.7,رتبه اول برد ارتوپدی ایران,2,73,ارتوپدی_doctor_156.json,ارتوپدی_doctor_156.json,1
191246,گوش_حلق_و_بینی_doctor_278.json,https://nobat.ir/dralmassi,dralmassi,دکتر محمدرضا الماسی,متخصص جراحی گوش ، گلو ، بینی ، سر و گردن,متخصصشماره نظام: ۳۸۴۲۹,False,,119.0,96.0,4.8,,1,77,گوش_حلق_و_بینی_doctor_278.json,گوش_حلق_و_بینی_doctor_278.json,1
191500,ارتوپدی_doctor_199.json,https://nobat.ir/lp5d,lp5d,دکتر حسن درتاج,متخصص جراحی استخوان و مفاصل ( ارتوپدی ),متخصصشماره نظام: ۳۲۷۳۷,False,,167.0,96.0,4.8,دکتر حسن درتاج فلوشیپ فوق تخصصی جراحی شانه و زانو از اتریش عضو آکادمی ارتوپدی آرتروسکوپی آمریکا,1,91,ارتوپدی_doctor_199.json,ارتوپدی_doctor_199.json,1
191607,گوش_حلق_و_بینی_doctor_204.json,https://nobat.ir/doctor/%D8%AF%DA%A9%D8%AA%D8%B1-%D9%85%D8%B3%D8%B9%D9%88%D8%AF-%D8%A8%D9%86%DB%8C%D8%A7%D8%AF%DB%8C-%D8%AA%D9%87%D8%B1%D8%A7%D9%86/dr-7qen/vs-1,7qen,دکتر مسعود بنیادی,متخصص گوش و حلق و بینی,متخصصشماره نظام: ۲۴۷۸۱,False,,96.0,90.0,4.5,,1,59,گوش_حلق_و_بینی_doctor_204.json,گوش_حلق_و_بینی_doctor_204.json,1
