doctor_id,source_file,profile_url,nice_id,name,specialty,medical_code,verified,followers_count,reviews_count,rating_percent,rating_score_5,biography,office_count,comments_count_in_file,selected_source_file,all_source_files,source_files_count
100246,پوست_و_مو_doctor_337.json,https://nobat.ir/3023,3023,دکتر علیرضا تقی زاده,متخصص پوست ، مو و زیبایی,متخصصشماره نظام: ۴۸۸۷۵,False,,205.0,86.0,4.3,,1,134,پوست_و_مو_doctor_337.json,پوست_و_مو_doctor_337.json,1
100332,ارتوپدی_doctor_203.json,https://nobat.ir/doctor/%D8%AF%DA%A9%D8%AA%D8%B1-%DA%A9%D9%88%D8%B1%D8%B4-%D9%81%D8%A7%D8%AA%D8%AD-%D8%AA%D9%87%D8%B1%D8%A7%D9%86/dr-3034/vs-1,3034,دکتر کورش فاتح,متخصص ارتوپدی - تعویض مفصل,متخصصشماره نظام: ۴۲۲۶۸,False,,256.0,86.0,4.3,,3,169,ارتوپدی_doctor_203.json,ارتوپدی_doctor_203.json,1
102091,پوست_و_مو_doctor_369.json,https://nobat.ir/dresfahani,dresfahani,دکتر منصور اصفهانی,متخصص پوست ، مو و لیزر,متخصصشماره نظام: ۳۲۲۸۲,False,,464.0,90.0,4.5,اینجانب دکتر منصور اصفهانی متولد شهر زیبای رشت در استان گیلان می باشم، درسال ۱۳۶۳ پس از اخذ دیپلم علوم تجربی با کسب رتبه ۱۰۵ در کنکور سراسری همان سال در دانشگاه اصفهان وارد رشته پزشکی شدم. تجربه هفت سال زندگی در شهر زیبای اصفهان و یاد دروازه شیراز و دانشگاه زیبای اصفهان، زاینده رود، سی و سه پل و پلی خواجو (با لهجه شیرین اصفهانی) را همیشه به نیکی یاد می کنم.در سال ۱۳۷۰ پس از فارغ التحصیلی عازم خطه کردستان شدم جهت انجام خدمت وظیفه عمومی و انجام خدمات طرح نیروی انسانی به مدت پنج سال، سپس در تهران مشغول به کار شدم.در سال ۱۳۸۰ در رشته تخصصی بیماریهای پوست دانشگاه علوم پزشکی ایران پذیرفته و از علم و دانش استادانی چون مرحوم دکتر انصارین، مرحوم دکتر عزیز جلالی، استاد راثی و دکتر غفارپور، خانم ها دکتر مهران و دکتر عاطفی بهره مند شدم. پس از فراغت از دوره تخصصی در سال ۱۳۸۴ در استان ایلام مشغول تدریس در دانشگاه علوم پزشکی و مداوای بیماران در بیمارستان و مطب شخصی شدم. این دوره ده ساله همراه با خاطرات خوب از دوستان و مردم عزیز ایلام است و استان ایلام، موطن دوم من است. از سال ۱۳۹۴ تا کنون در شهر تهران در کلینیک تخصصی پوست بهسیما و مطب شریعتی در خدمت بیماران و مراجعین عزیز هستم. دکتر منصوراصفهانی مهرماه ۱۴۰۴,2,257,پوست_و_مو_doctor_369.json,پوست_و_مو_doctor_369.json,1
102727,زنان_و_زایمان_doctor_92.json,https://nobat.ir/drlavasani,drlavasani,دکتر زهره لواسانی,متخصص زنان و زایمان ( فلوشیپ نازایی )، IVF و لاپاراسکوپی,فلوشیپشماره نظام: ۶۴۷۳۱,False,,843.0,90.0,4.5,درباره من – دکتر زهره لواسانی – جراح و متخصص زنان و فلوشیب فوق‏ تخصصی نازایی، IVF و جراحی لاپاراسکوپی – عضو هیات علمی دانشگاه ........................................................................................................................... ویژگی ها – فوق تخصص از دانشگاه علوم پزشکی تهران – عضو هیآت علمی دانشگاه و تدریس در دانشگاه – 23 سال تجربه تخصصی و فوق تخصصی زنان، زایمان و نازایی – تالیف و ترجمه ده ها کتاب و مقاله علمی – تاییدیه علمی و اخلاقی از اساتید برجسته حوزه زنان – پایبندی کامل به اصول اخلاق حرفه ای و تعهد کاری – پاسخگویی آنلاین و اینترنتی به سئوالات بیماران – دریافت کمتر از تعرفه های مصوب پزشکی و تخفیف به بیماران – رضایتمندی بالای بیماران در درمان های فوق تخصصی و تخصصی – قرارداد با بیمارستان های مختلف و امکان انتخاب بیمارستان توسط بیمار – فعالیت در دو بخش دولتی و خصوصی و امکان انتخاب آن توسط بیمار – انجام جراحی های فراوان سزارین و جراحی های پیشرفته لاپاراسکوپی ........................................................................................................................... درمان ‏های تخصصی و فوق‏ تخصصی زنان، ناباروری و لاپاراسکوپی ۱. درمان‏ های نوین کمک ‏باروری شامل: IUI، IVF و ICSI ۲. جراحی لاپاراسکوپی، هیستروسکوپی و کولپوسکوپی ۳. تعیین جنسیت دلخواه جنین قبل از بارداری ۴. فریز تخمک خانم‏ های مجرد و فریز جنین ۵. بارداری با تخمک اهدایی و رحم جایگزین ۶. سزارین، زایمان و جراحی‏ های پیشرفته زنان ۷. درمان کیست و پلی ‏کیستیک تخمدان (PCOs) ۸. درمان ‏های نوین بیماری ‏ها و عفونت‏ های زنان ۹. سلامت جنسی و درمان بیماری های آمیزشی ۱۰. درمان سقط مکرر و حاملگی خارج رحمی (EP) ۱۱. مشاوره و مراقبت‏ های قبل و حین بارداری ۱۲. سونوگرافی واژینال رحم و تخمدان ‏ها و بارداری ۱۳. بررسی و درمان اختلالات قاعدگی و هورمونی ۱۴. تشخیص و درمان پولیپ و فیبروم‏ رحمی ۱۵. غربالگری ‏سلامت مادر و جنین در بارداری ........................................................................................................................... مطب – فعالیت مطب: روزهای یکشنبه، سه شنبه و چهارشنبه: آدرس مطب: تهران، میدان فلسطین، 50 متر پایین تر از میدان (خ فلسطین)، ساختمان پزشکان 157، طبقه همکف، تلفن: 66486836، موبایل: 09101848713 ........................................................................................................................... راه های ارتباطی – تلفن مطب: 66486836 (میدان فلسطین) – پیامک و تلگرام: 09101848713 – پیج اینستاگرام dr.zlavasani@ (امکان پاسخگویی به سوالات کاربران عزیز) – کانال تلگرام drzlavasani@ – وب سایت: در دست طراحی dr-lavasani.ir – وب سایت داک تاپ: امکان پاسخگویی به سوالات کاربران عزیز ( doctop.ir) ........................................................................................................................... – مشاوره و پاسخگویی اینترنتی رایگان اینجانب به طور رایگان و با افتخار پاسخگوی سئوالات همه عزیزان، به ویژه هموطنان عزیز شهرستانی در خصوص موارد مرتبط با سلامت زنان و به ویژه در زمینه درمان های نوین نازایی و تعیین جنسیت هستم، برای ارسال سئوال و دریافت پاسخ آن، می ‏توانید بر روی لینک زیر کلیک کنید: doctop.ir/members/zohrehlavasani/ask ***,1,243,زنان_و_زایمان_doctor_92.json,زنان_و_زایمان_doctor_92.json,1
103130,ارتوپدی_doctor_195.json,https://nobat.ir/3258,3258,دکتر مسعود یاوری,فلوشیپ جراحی دست,فلوشیپشماره نظام: ۳۱۱۳۲,False,,636.0,94.0,4.7,دکتر مسعود یاوری: استاد تمام دانشگاه، دبیر انجمن جراحان دست ایران، فلوشیپ جراحی دست، میکروسرجری و اعصاب محیطی,1,232,ارتوپدی_doctor_195.json,ارتوپدی_doctor_195.json,1
103641,گوش_حلق_و_بینی_doctor_263.json,https://nobat.ir/drbarati,drbarati,دکتر بهروز براتی,فلوشیپ جراحی گوش,فوق‌تخصصشماره نظام: ۶۸۸۰۶,False,,794.0,96.0,4.8,,1,232,گوش_حلق_و_بینی_doctor_263.json,گوش_حلق_و_بینی_doctor_263.json,1
103646,کلیه_و_مجاری_ادراری_(اورولوژی)_doctor_515.json,https://nobat.ir/3265,3265,دکتر علیرضا سینا,متخصص جراحی کلیه و مجاری ادراری,فلوشیپشماره نظام: ۵۶۹۹۷,False,,250.0,96.0,4.8,دکتر علیرضا سینا متخصص جراحی کلیه، مجاری ادراری و تناسلی (اورولوژی) فلوشیپ فوق تخصصی اورولوژی کودکان و اختلالات ادراری مادرزادی عضویت ها عضویت در انجمن ارولوژی ایران عضویت در انجمن اروپایی ارولوژی (EAU) عضویت درانجمن بین المللی ارولوژی (SIU),1,148,کلیه_و_مجاری_ادراری_(اورولوژی)_doctor_515.json,کلیه_و_مجاری_ادراری_(اورولوژی)_doctor_515.json,1
103670,گوش_حلق_و_بینی_doctor_226.json,https://nobat.ir/3267,3267,دکتر یوسف یعقوبلو,جراح گوش و حلق بینی و زیبایی بینی و صورت,متخصصشماره نظام: ۱۰۸۲۶۰,False,,106.0,94.0,4.7,,1,63,گوش_حلق_و_بینی_doctor_226.json,گوش_حلق_و_بینی_doctor_226.json,1
104548,مغز_و_اعصاب_doctor_427.json,https://nobat.ir/taghdiri,taghdiri,دکتر محمد مهدی تقدیری,فوق تخصص مغز و اعصاب کودکان ، استاد دانشگاه,فوق‌تخصصشماره نظام: ۲۸۶۱۱,False,,2663.0,96.0,4.8,,2,244,مغز_و_اعصاب_doctor_427.json,مغز_و_اعصاب_doctor_427.json,1
