doctor_id,source_file,profile_url,nice_id,name,specialty,medical_code,verified,followers_count,reviews_count,rating_percent,rating_score_5,biography,office_count,comments_count_in_file,selected_source_file,all_source_files,source_files_count
319781,پوست_و_مو_doctor_316.json,https://nobat.ir/k.ahmadi,k.ahmadi,دکتر کورش احمدی,متخصص پوست ، مو و زیبایی و لیزر,متخصصشماره نظام: ۱۶۹۲۰۵,False,,36.0,96.0,4.8,متخصص بیماریهای پوست مو و زیبایی (درماتولوژی) از دانشگاه شیراز دانشجوی برتر دانشگاه علوم پزشکی مشهد عضو انجمن متخصصین پوست ایران تشخیص و درمان بیماری پوست، مو و ناخن بیماریهای خود ایمنی و التهابی پوست پسوریازیس، لیکن پلان، درماتیت آتوپیک، ریزش مو، جوش صورت، موهای زائد و ویتیلیگو، ارزیابی روند پیری پوست و درمان اختلالات همراه با پیری پوست (لک آفتابی، تومورهای خوش خیم و بدخیم، چین و چروک پوست)، زگیل تناسلی مشاوره زیبایی اختصاصی جهت انجام پروسیجرهای درمانی و زیبایی، جراحیهای محدود پوست، لیزر، تزریق چربی، تزریق فیلر، بوتاکس، لیفت ابرو، لیزر اندولیف، آر آف، رفع غب غب، جای جوش، پیلینگ شیمیایی و میکرونیدلنیگ,1,22,پوست_و_مو_doctor_316.json,پوست_و_مو_doctor_316.json,1
319788,ارتوپدی_doctor_150.json,https://nobat.ir/dralirezaaskari,dralirezaaskari,دکتر علیرضا عسکری,جراح و متخصص ارتوپدی - فلوشیپ جراحی زانو,فلوشیپشماره نظام: ۱۱۷۲۵۰,False,,136.0,90.0,4.5,-ورودی پزشکی۱۳۷۸با رتبه ۱۷۸تجربی -دانشجوی برتر پزشکی کشور سال۱۳۸۰ -دانشجوی استریت (رتبه اول) پزشکی دوره و ورود مستقیم به دوره رزیدنتی ارتوپدی ۱۳۸۵ -فلوشیپ جراحی زانو دانشگاه علوم پزشکی ایران -استاددانشگاه علوم پزشکی ایران -دارای سوابق درخشان پژوهشی با H-index=13 G-index=20 -دارای ۳۹مقاله علمی در سطح بین المللی و سخنران برتر در کنگره های علمی زانو در داخل و خارج کشور,3,79,ارتوپدی_doctor_150.json,ارتوپدی_doctor_150.json,1
319817,زنان_و_زایمان_doctor_89.json,https://nobat.ir/doctor/%D8%AF%DA%A9%D8%AA%D8%B1-%D8%A7%D8%B9%D8%B8%D9%85-%D8%AD%D8%B3%DB%8C%D9%86%DB%8C-%D8%AA%D9%87%D8%B1%D8%A7%D9%86/dr-23183/vs-1,23183,دکتر اعظم حسینی,جراح و متخصص زنان ، زایمان و نازایی,متخصصشماره نظام: ۱۱۳۹۷۰,False,,126.0,94.0,4.7,متخصص زنان، زایمان و نازایی از دانشگاه علوم پزشکی ایران با کسب رتبه برتر ده کشوری.با بیش از ده سال سابقه طبابت، فلوشیپ زیبایی زنان,1,82,زنان_و_زایمان_doctor_89.json,زنان_و_زایمان_doctor_89.json,1
319878,پوست_و_مو_doctor_398.json,https://nobat.ir/23226,23226,دکتر سیده حمیده مولائی,متخصص پوست و مو,متخصصشماره نظام: ۸۱۴۴۹,False,,119.0,94.0,4.7,متخصص پوست ومو زیبایی ولیزر عضو هیئت علمی دانشگاه,1,75,پوست_و_مو_doctor_398.json,پوست_و_مو_doctor_398.json,1
319927,کلیه_و_مجاری_ادراری_(اورولوژی)_doctor_535.json,https://nobat.ir/23263,23263,دکتر سیدرضا یحیی زاده لنگرودی,فلوشیپ پیوند کلیه و متخصص جراحی کلیه و مجاری ادراری,فلوشیپشماره نظام: ۱۰۱۲۶۷,False,,92.0,96.0,4.8,متخصص جراحی کلیه و مجاری ادرار فلوشیپ پیوند کلیه عضو هیات علمی دانشگاه علوم پزشکی تهران,1,65,کلیه_و_مجاری_ادراری_(اورولوژی)_doctor_535.json,کلیه_و_مجاری_ادراری_(اورولوژی)_doctor_535.json,1
319939,پوست_و_مو_doctor_396.json,https://nobat.ir/doctor/%D8%AF%DA%A9%D8%AA%D8%B1-%D9%85%D8%A7%D9%86%DB%8C-%D8%AF%D8%B3%D8%AA%D8%BA%DB%8C%D8%A8-%D8%AA%D9%87%D8%B1%D8%A7%D9%86/dr-dr.mani/vs-1,dr.mani,دکتر مانی دستغیب,متخصص و جراح پوست ، زیبایی و لیزر,متخصصشماره نظام: ۱۲۳۲۹۳,False,,116.0,86.0,4.3,جوانسازی صورت با لیزر و جراحی لیفت صورت و ابرو و بلفاروپلاستی مدلینگ چهره، بوتاکس فیلر و نانوفت پیکرتراشی ۳۶۰ رفع لک و تیرگی های صورت و بدن تجهیزات پیشرفته: آر اف Virtue Youlaser Endolift Picostar Angela Fraxel Candela,3,75,پوست_و_مو_doctor_396.json,پوست_و_مو_doctor_396.json,1
319955,کلیه_و_مجاری_ادراری_(اورولوژی)_doctor_568.json,https://nobat.ir/farzam.mahmoodi,farzam.mahmoodi,دکتر فرزام محمودی,متخصص جراحی کلیه و مجاری ادراری و تناسلی,متخصصشماره نظام: ۱۵۸۸۳۱,False,,28.0,96.0,4.8,,1,20,کلیه_و_مجاری_ادراری_(اورولوژی)_doctor_568.json,کلیه_و_مجاری_ادراری_(اورولوژی)_doctor_568.json,1
320000,گوش_حلق_و_بینی_doctor_265.json,https://nobat.ir/dr.minajamali,dr.minajamali,دکتر مینا جمالی,متخصص گوش و حلق و بینی,متخصصشماره نظام: ۱۴۱۶۸۳,False,,84.0,96.0,4.8,فارغ التحصیل از دانشگاه علوم پزشکی ایران بیمارستان عرفان سعادت آباد بیمارستان میلاد جراحی لوزه جراحی زیبایی و درمانی بینی جراحی اندوسکوپی سینوس جراحی تیرویید جراحی غدد بزاقی بلفاروپلاستی پلک بالا تزریق بوتاکس,1,58,گوش_حلق_و_بینی_doctor_265.json,گوش_حلق_و_بینی_doctor_265.json,1
320173,گوش_حلق_و_بینی_doctor_258.json,https://nobat.ir/23458,23458,دکتر جواد یارمحمدی,جراح و متخصص گوش ، حلق و بینی,متخصصشماره نظام: ۱۶۸۴۸۲,False,,91.0,86.0,4.3,جراح پلاستیک بینی و صورت جراح و متخصص گوش، حلق و بینی بورد تخصصی از دانشگاه شهید بهشتی,1,64,گوش_حلق_و_بینی_doctor_258.json,گوش_حلق_و_بینی_doctor_258.json,1
320197,زنان_و_زایمان_doctor_2.json,https://nobat.ir/dr.s.rezaei,dr.s.rezaei,دکتر سوسن رضائی,جراح و متخصص زنان زایمان نازایی,متخصصشماره نظام: ۱۵۲۲۲۴,False,,99.0,90.0,4.5,جراح زنان و زایمان و نازایی، کولپوسکوپی و زیبایی زنان از دانشگاه تهران عضو بنیاد ملی نخبگان ایران عضو انجمن جراحان زنان ایران رتبه برتر بورد تخصصی کشور مشاوره و درمان بیماریهای جنسی زنان، تزریق ژل به ناحیه تناسلی جهت جوان سازی، جراحی تنگی واژن، برداشتن پوست اضافه شکم هنگام جراحی برداشتن زگیل و خال مشاوره و تشخیص و درمان: نازایی، بارداری، زایمان، سقطهای مکرر، hpv، پاپ اسمیر، خونریزیهای مکرر، مشکلات تخمدان، زگیل و تبخال تناسلی بیماریهای مقاربتی، جراحی های زیبایی زنان، لابیا پلاستی، پلاسما تراپی، دستگاه پلاسما جهت کاهش افتادگی های واژن و افزایش میل جنسی و ازون تراپی,2,69,زنان_و_زایمان_doctor_2.json,زنان_و_زایمان_doctor_2.json,1
320309,مغز_و_اعصاب_doctor_416.json,https://nobat.ir/doctor/%D8%AF%DA%A9%D8%AA%D8%B1-%D8%B3%DB%8C%D8%AF%D9%81%D8%B1%D9%87%D9%86%DA%AF-%D9%85%D8%B1%D8%B4%D8%AF-%D8%AA%D9%87%D8%B1%D8%A7%D9%86/dr-farhangmorshed/vs-1,farhangmorshed,دکتر سیدفرهنگ مرشد,متخصص و جراح مغز اعصاب و ستون فقرات,متخصصشماره نظام: ۱۳۰۸۰۲,False,,270.0,94.0,4.7,من سید فرهنگ مرشد متولد ۱۶ بهمن ۱۳۶۲ در شهرستان آمل واقع در استان مازندران هستم . مقاطع تحصیلی قبل از دانشگاه را در همان شهر محل تولدم آمل سپری کرده و در کنکور سراسری سال ۱۳۸۱ با رتبه ۷۰۰ پذیرفته دانشگاه علوم پزشکی مازندران و دانشکده پزشکی ساری و فارغ التحصیل و دانش آموخته سال ۱۳۸۹ میباشم . طرح پزشکی عمومی و خدمت سربازی را بصورت توام در شهر ارومیه به مدت یکسال و نیم سپری کردم. در سال ۱۳۹۳ با رتبه ۷۰۵ پذیرفته رشته جراحی مغز و اعصاب و ستون فقرات دانشگاه علوم پزشکی مشهد شدم و بصورت ویژه تحت آموزش اساتید بنام جراحی اعصاب ایران آقای دکتر پرفسور محمد فرجی راد، آقای دکتر پروفسور فریبرز ثمینی و استاد گرامی سرکار خانم دکتر سمیرا ذبیحیان و استاد گرامی جناب آقای دکتر حمید رضایی بوده ام و با کسب رتبه ممتاز چهارم در امتحان گواهینامه و بورد (دانشنامه) تخصصی ایران در سال ۱۳۹۸ فارغ التحصیل و دانش آموخته شدم. پس از آن بصورت مستقیم در دانشگاه علوم پزشکی بیرجند به درجه استادیاری نائل شدم و معاونت آموزشی گروه جراحی اعصاب دانشگاه علوم پزشکی بیرجند و معاونت پژوهشی گروه جراحی اعصاب دانشگاه علوم پزشکی بیرجند و رئیس بخش جراحی اعصاب بیمارستان امام رضا بیرجند و عضو شورای عالی آموزشی دانشکده پزشکی بیرجند بودم و در حال حاضر در تهران در بیمارستان کسری و بیمارستان پارس و بیمارستان تندیس جردن مشغول به کار و طبابت هستم,1,162,مغز_و_اعصاب_doctor_416.json,مغز_و_اعصاب_doctor_416.json,1
320341,ارتوپدی_doctor_157.json,https://nobat.ir/doctor/%D8%AF%DA%A9%D8%AA%D8%B1-%D8%A7%D9%85%DB%8C%D8%B1-%D8%A8%D8%B1%D8%B2%D9%86%D9%88%D9%86%DB%8C-%D8%AA%D9%87%D8%B1%D8%A7%D9%86/dr-doctorbarz/vs-1,doctorbarz,دکتر امیر برزنونی,فلوشیپ جراحی لگن و مفصل ران ، متخصص ارتوپدی,فلوشیپشماره نظام: ۱۳۰۷۴۴,False,,106.0,96.0,4.8,️توجه داشته باشید نوبت ثبت شده فقط برای شهر تهران و مطب سعادت آباد می باشد️ فلوشیپ فوق تخصص جراحی لگن و مفصل ران جراح استخوان و مفاصل (مدرک بورد تخصصی از دانشگاه شهید بهشتی تهران) آسیب های ورزشی زانو و شانه جراح زانو، شانه و لگن تروما و شکستگی ها,1,79,ارتوپدی_doctor_157.json,ارتوپدی_doctor_157.json,1
320397,زنان_و_زایمان_doctor_56.json,https://nobat.ir/23604,23604,دکتر مروارید احمدبیگی,جراح و متخصص زنان و زایمان,متخصصشماره نظام: ۱۱۳۹۳۶,False,,220.0,90.0,4.5,پزشکی عمومی دانشگاه علوم پزشکی شهید بهشتی تخصص جراحی زنان و زایمان دانشگاه علوم پزشکی شیراز فلوشیپ لاپاروسکوپی پیشرفته و آندومتریوز پژوهشگاه ابن سینا,2,156,زنان_و_زایمان_doctor_56.json,زنان_و_زایمان_doctor_56.json,1
320428,کلیه_و_مجاری_ادراری_(اورولوژی)_doctor_527.json,https://nobat.ir/dr.a.sheikhzadeh,dr.a.sheikhzadeh,دکتر عبدالصمد شیخ زاده,متخصص جراحی کلیه و مجاری ادراری ( اورولوژی),متخصصشماره نظام: ۱۲۱۴۶۴,False,,56.0,90.0,4.5,,2,37,کلیه_و_مجاری_ادراری_(اورولوژی)_doctor_527.json,کلیه_و_مجاری_ادراری_(اورولوژی)_doctor_527.json,1
320533,مغز_و_اعصاب_doctor_505.json,https://nobat.ir/doctor/%D8%AF%DA%A9%D8%AA%D8%B1-%D8%AD%D8%A7%D9%85%D8%AF-%D8%AC%D9%88%D8%A7%D8%AF%DB%8C%D8%A7%D9%86-%D8%AA%D9%87%D8%B1%D8%A7%D9%86/dr-23690/vs-1,23690,دکتر حامد جوادیان,متخصص جراحی مغز و اعصاب دیسک و ستون فقرات,متخصصشماره نظام: ۱۳۱۳۱۳,False,,16.0,96.0,4.8,,2,13,مغز_و_اعصاب_doctor_505.json,مغز_و_اعصاب_doctor_505.json,1
320561,مغز_و_اعصاب_doctor_488.json,https://nobat.ir/dr.nasibeh.amirzargar,dr.nasibeh.amirzargar,دکتر نسیبه امیرزرگر,متخصص بیماریهای مغز و اعصاب ( نورولوژیست ),متخصصشماره نظام: ۱۲۸۵۳۱,False,,25.0,94.0,4.7,دارای بورد تخصصی از دانشگاه علوم پزشکی تهران سابقه ۱۱ سال طبابت در تنها بیمارستان توانبخشی کشور بررسی، تشخیص و درمان: اختلالات حافظه و بیماری آلزایمر، اختلالات حرکتی و بیماری پارکینسون، بیماریهای اعصاب محیطی و عضلات اسکلتی، سکته و خونریزی مغزی، درد گردن و کمردرد، انواع سردرد و میگرن، عدم تعادل و سرگیجه، بیماری ام اس، اختلالات خواب، حملات تشنج و صرع، سابقه ضربه مغزی و ضایعه نخاعی,2,18,مغز_و_اعصاب_doctor_488.json,مغز_و_اعصاب_doctor_488.json,1
320620,گوش_حلق_و_بینی_doctor_233.json,https://nobat.ir/23751,23751,دکتر بیژن فرهنگی,متخصص و جراح کوش و حلق و بینی,متخصصشماره نظام: ۹۵۴۵,False,,43.0,90.0,4.5,,2,29,گوش_حلق_و_بینی_doctor_233.json,گوش_حلق_و_بینی_doctor_233.json,1
320644,زنان_و_زایمان_doctor_20.json,https://nobat.ir/doctor/%D8%AF%DA%A9%D8%AA%D8%B1-%D9%85%D8%B1%DB%8C%D9%85-%D9%85%D9%88%D8%B3%D9%88%DB%8C-%D8%AA%D9%87%D8%B1%D8%A7%D9%86/dr-23769/vs-1,23769,دکتر مریم موسوی,متخصص و جراح زنان و زایمان,متخصصشماره نظام: ۱۱۶۳۷۳,False,,69.0,94.0,4.7,,1,43,زنان_و_زایمان_doctor_20.json,زنان_و_زایمان_doctor_20.json,1
320761,گوش_حلق_و_بینی_doctor_283.json,https://nobat.ir/23857,23857,دکتر سعیده شوشتری,متخصص گوش ، حلق ، بینی و جراحی سر و گردن,متخصصشماره نظام: ۱۱۹۹۶۳,False,,103.0,96.0,4.8,فارغ التحصیل دانشگاه علوم پزشکی تهران، دارای بورد تخصصی.,1,73,گوش_حلق_و_بینی_doctor_283.json,گوش_حلق_و_بینی_doctor_283.json,1
321209,ارتوپدی_doctor_121.json,https://nobat.ir/doctor/%D8%AF%DA%A9%D8%AA%D8%B1-%D8%AC%D9%85%D8%B4%DB%8C%D8%AF-%D8%A7%DB%8C%D9%85%D8%A7%D9%86%DB%8C-%D8%AA%D9%87%D8%B1%D8%A7%D9%86/dr-24182/vs-1,24182,دکتر جمشید ایمانی,متخصص ارتوپدی,متخصصشماره نظام: ۲۶۱۷۲,False,,257.0,84.0,4.2,,1,175,ارتوپدی_doctor_121.json,ارتوپدی_doctor_121.json,1
321210,زنان_و_زایمان_doctor_58.json,https://nobat.ir/24183,24183,دکتر معصومه طالبی,جراح و متخصص زنان ، زایمان و نازایی,متخصصشماره نظام: ۱۳۵۰۵۲,False,,66.0,90.0,4.5,««کلیه جراحی ها هم زیبایی و هم درمانی با کمترین هزینه و بصورت اقساطی مطابق با شرایط مالی شما عزیزان انجام میشود.» لطفا نوبت دهی از طریق سایت یا تماس با شماره های زیر انجام شود 09389327712 09338332148 09965670016 02166940864 جراح و متخصص زنان زایمان و نازایی فلوشیپ فوق تخصص لاپاراسکوپی پیشرفته آندومتریوز و هیستروسکوپی عضو انجمن جراحان زنان آمریکا عضو انجمن جراحان زیبایی اروپا عضو انجمن علمی جراحی های کم تهاجمی ایران عضو سابق گروه تخصصی آندومتریوز و دردهای لگنی کلینیک ناباروری و سقط مکرر ابن سینا,3,43,زنان_و_زایمان_doctor_58.json,زنان_و_زایمان_doctor_58.json,1
321374,کلیه_و_مجاری_ادراری_(اورولوژی)_doctor_551.json,https://nobat.ir/24298,24298,دکتر مسعود عارف نیا,فلوشیپ جراحی کلیه ، مثانه و مجاری ادراری ( اروانکولوژیست ),فلوشیپشماره نظام: ۱۱۷۶۶۵,False,,,,,,1,0,کلیه_و_مجاری_ادراری_(اورولوژی)_doctor_551.json,کلیه_و_مجاری_ادراری_(اورولوژی)_doctor_551.json,1
321527,زنان_و_زایمان_doctor_23.json,https://nobat.ir/doctor/%D8%AF%DA%A9%D8%AA%D8%B1-%D9%81%D8%B1%DB%8C%D9%86%D8%A7%D8%B2-%D8%B4%D9%87%D9%85%D8%B1%D8%A7%D8%AF%DB%8C-%D8%AA%D9%87%D8%B1%D8%A7%D9%86/dr-24407/vs-1,24407,دکتر فریناز شهمرادی,جراح و متخصص زنان و زایمان فلوشیپ ناباروری و آی وی اف,فلوشیپشماره نظام: ۱۱۵۸۴۸,False,,,,,,1,0,زنان_و_زایمان_doctor_23.json,زنان_و_زایمان_doctor_23.json,1
321542,پوست_و_مو_doctor_365.json,https://nobat.ir/24418,24418,دکتر شیوا قدس,متخصص پوست ، مو ، زیبایی و لیزر,متخصصشماره نظام: ۱۴۵۴۹۵,False,,27.0,96.0,4.8,دکتر شیوا قدس متخصص پوست مو زیبایی و لیزر دارای بورد تخصصی پوست و مو عضو انجمن متخصصین پوست ایران دوره پزشکی عمومی خود را در دانشگاه علوم پزشکی ایران گذرانده و با کسب رتبه برتر ازمون پیش کارورزی و شرکت در آزمون دستیاری در رشته تخصصی پوست و مو دانشگاه علوم پزشکی ایران پذیرفته شده. در طول دوران رزیدنتی طی دو سال متوالی موفق به کسب رتبه اول پرزنتیشن دستیاری در کنگره سالانه تخصصی پوست و مو شده و در حال حاضر با درمان بیماریهای پوست و مو و ارائه خدمات زیبایی در شهر تهران در حال فعالیت میباشد.,1,14,پوست_و_مو_doctor_365.json,پوست_و_مو_doctor_365.json,1
321543,ارتوپدی_doctor_145.json,https://nobat.ir/doctor/%D8%AF%DA%A9%D8%AA%D8%B1-%D9%85%D8%AD%D9%85%D8%AF%D8%B1%D8%B6%D8%A7-%D8%B5%D8%A7%D8%AF%D9%82%DB%8C-%D8%AA%D9%87%D8%B1%D8%A7%D9%86/dr-drsadeghiorthoped/vs-1,drsadeghiorthoped,دکتر محمدرضا صادقی,متخصص جراحی استخوان و مفاصل ( ارتوپدی ),متخصصشماره نظام: ۱۳۲۴۹۵,False,,84.0,96.0,4.8,جراح برتر ارتوپدی (جراح زانو، لگن و ...) دانشگاه علوم پزشکی تهران فلوشیپ زانو و تعویض مفصل از دانشگاه Knoppschoft آلمان فلوشیپ درمان اختلال طول و انحراف اندام از Ilizarov روسیه فلوشیپ تروما و شکستگی از AO سوییس رتبه برتر بورد تخصصی جراحی ارتوپدی در ایران دانشجوی برتر جراحی ارتوپدی دانشگاه تهران دانشجوی برتر پزشکی عمومی دانشگاه تهران,1,58,ارتوپدی_doctor_145.json,ارتوپدی_doctor_145.json,1
3216,ارتوپدی_doctor_138.json,https://nobat.ir/sepanta,sepanta,دکتر حبیب رشادی,جراح و متخصص استخوان و مفاصل (ارتوپد),متخصصشماره نظام: ۷۱۸۳۹,False,,544.0,84.0,4.2,دوره فلوشیپ جراحی زانو از کانادا و دوره تکمیلی جراحیهای زانو و آرتروسکوپی انجمن جراحیهای زانو و آسیب های ورزشی اروپا دوره تکمیلی جراحیهای تعویض مفاصل زانو وآسیبهای ورزشی از اتریش دوره تکمیلی جراحیهای بازسازی منیسک ورباط های صلیبی نفراول بیستمین دوره امتحان پره انترنی نفربرگزیده بورد پوتا ی ایران دوره تکمیلی جراحیهای بازسازی مفاصل زانو ولگن جراحیهای اصلاح حالت های پرانتزی وضربدری زانوها جراحیهای تعویض مفصل لگن جراحیهای غیرتهاجمی آسیبهای شانه کارشناس پزشکی سیما مسئول کمیته پزشکی کاراته,1,223,ارتوپدی_doctor_138.json,ارتوپدی_doctor_138.json,1
321667,گوش_حلق_و_بینی_doctor_248.json,https://nobat.ir/24508,24508,دکتر ندا صالح جعفری,متخصص گوش و حلق و بینی,متخصصشماره نظام: ۸۳۴۵۹,False,,114.0,90.0,4.5,,1,77,گوش_حلق_و_بینی_doctor_248.json,گوش_حلق_و_بینی_doctor_248.json,1
321794,ارتوپدی_doctor_180.json,https://nobat.ir/doctor/%D8%AF%DA%A9%D8%AA%D8%B1-%D9%85%D8%B5%D8%B7%D9%81%DB%8C-%D8%B5%D8%A7%D9%84%D8%AD-%D9%BE%D9%88%D8%B1%D9%85%D9%84%DA%A9%D8%B4%D8%A7%D9%87-%D8%AA%D9%87%D8%B1%D8%A7%D9%86/dr-salehpour/vs-1,salehpour,دکتر مصطفی صالح پورملکشاه,جراح استخوان و مفاصل - فلوشیپ جراحی زانو,فلوشیپشماره نظام: ۱۵۱۰۶۰,False,,48.0,94.0,4.7,دکتر مصطفی صالح پور ملکشاه دارای مدرک بورد تخصصی ارتوپدی (جراح استخوان و مفاصل) و فوق تخصص جراحی زانو، آسیبهای ورزشی و تعویض مفصل زانو و لگن میباشند. . جراحی های فوق تخصصی زانو و لگن و شانه که در طول ۹ سال سابقه درمان بیماران با مشکلات ارتوپدی بیش از ۹۰۰۰ جراحی موفق در کشور انجام داده اند. ارائه دهنده مقالات و سخنران در کنگره های بین المللی میباشند.,1,22,ارتوپدی_doctor_180.json,ارتوپدی_doctor_180.json,1
321818,زنان_و_زایمان_doctor_67.json,https://nobat.ir/24620,24620,دکتر شقایق حاتمی,جراح و متخصص زنان و زایمان و نازایی,متخصصشماره نظام: ۱۴۲۱۳۷,False,,331.0,96.0,4.8,جراح و متخصص زنان زایمان نازایی و ژنیکواستتیک (زیبایی زنان) دارای بورد تخصصی از دانشگاه شهید بهشتی غربالگری سرطان های شایع (پاپ اسمیر و HPV) درمان زگیل تناسلی (کرایو یا فریز، لیزر و..) کولپوسکوپی مراقبت بارداری زایمان طبیعی سزارین درمان نازایی لبیاپلاستی و...,1,234,زنان_و_زایمان_doctor_67.json,زنان_و_زایمان_doctor_67.json,1
321851,گوش_حلق_و_بینی_doctor_237.json,https://nobat.ir/dr_zadi,dr_zadi,دکتر حسین زادی,جراح و متخصص گوش و حلق و بینی,متخصصشماره نظام: ۱۵۳۷۴۳,False,,196.0,94.0,4.7,جراح و متخصص گوش و حلق و زیبایی بینی از دانشگاه علوم پزشکی تهران، دارای بورد تخصصی از بیمارستان امیر اعلم دانشگاه علوم پزشکی تهران,2,128,گوش_حلق_و_بینی_doctor_237.json,گوش_حلق_و_بینی_doctor_237.json,1
322089,زنان_و_زایمان_doctor_49.json,https://nobat.ir/doctor/%D8%AF%DA%A9%D8%AA%D8%B1-%D8%B2%D9%87%D8%B1%D9%87-%D8%A7%D9%85%DB%8C%D8%B1%DB%8C-%D8%AA%D9%87%D8%B1%D8%A7%D9%86/dr-24823/vs-1,24823,دکتر زهره امیری,متخصص زنان و زایمان,متخصصشماره نظام: ۱۳۵۵۲۷,False,,178.0,86.0,4.3,جراح و متخصص زنان فلوشیپ زیبایی زنان (لابیاپلاستی، تزریق فیلر، تنگیواژن، تزریقچربی),1,119,زنان_و_زایمان_doctor_49.json,زنان_و_زایمان_doctor_49.json,1
