doctor_id,source_file,profile_url,nice_id,name,specialty,medical_code,verified,followers_count,reviews_count,rating_percent,rating_score_5,biography,office_count,comments_count_in_file,selected_source_file,all_source_files,source_files_count
254368,گوش_حلق_و_بینی_doctor_271.json,https://nobat.ir/12245,12245,دکتر سیداحسان امیری زاد,فلوشیپ بینی ، سینوس و جراحی قاعده جمجمه,فلوشیپشماره نظام: ۱۲۵۷۳۸,False,,106.0,94.0,4.7,متخصص گوش گلو و بینی جراح گوش، سر و گردن، سینوس، قاعده جمجمه، پلاستیک صورت بورد تخصصی دانشگاه علوم پزشکی تهران (بیمارستان امیراعلم) هیئت علمی درمانی بیمارستان امیر اعلم,2,68,گوش_حلق_و_بینی_doctor_271.json,گوش_حلق_و_بینی_doctor_271.json,1
255219,زنان_و_زایمان_doctor_15.json,https://nobat.ir/saranikfarjam,saranikfarjam,دکتر سارا نیک فرجام,متخصص زنان زایمان و نازایی,متخصصشماره نظام: ۱۴۰۲۴۴,False,,462.0,94.0,4.7,سارا نیک فرجام هستم. فارغ التحصیل پزشکی عمومی از دانشگاه شهید بهشتی تهران و تخصص زنان و زایمان و نازایی از دانشگاه جندی شاپور اهواز. برای درمان شما عزیزان از جدیدترین داروها و درمان ها و برای عمل های جراحی از روش های لاپاراسکوپی و هیستروسکوپی استفاده می کنم. همچنین جراحی های زیبایی را با بهترین تکنیک ها و متدهای روز دنیای علم انجام می دهم. هزاران جراحی درمانی سنگین و زیبایی در کارنامه خود دارم و هزاران زوج نابارور را به یاری خدا و صبر زوج ها درمان کرده ام. هزاران سزارین و زایمان طبیعی انجام داده ام و تعداد بسیار زیادی از بیماران بدحال با بیماری های پیچیده را از مرگ نجات داده ام. از خداوند می خواهم که توانایی من را برای یاری رساندن به زنان کشورم افزایش دهد. سلامتی شما آرزوی من است.,1,270,زنان_و_زایمان_doctor_15.json,زنان_و_زایمان_doctor_15.json,1
255309,گوش_حلق_و_بینی_doctor_242.json,https://nobat.ir/dr_khoshkhoo.official,dr_khoshkhoo.official,دکتر کیوان خوشخو,متخصص گوش و حلق و بینی,متخصصشماره نظام: ۶۶۰۲۶,False,,141.0,94.0,4.7,عضو انجمن گوش و حلق و بینی آمریکا جراحی زیبایی بینی و صورت,2,83,گوش_حلق_و_بینی_doctor_242.json,گوش_حلق_و_بینی_doctor_242.json,1
256303,ارتوپدی_doctor_117.json,https://nobat.ir/12522,12522,دکتر حامد احمدی زاده,متخصص ارتوپدی جراح استخوان مفاصل و آسیب های ورزشی,متخصصشماره نظام: ۱۵۰۰۱۷,False,,119.0,86.0,4.3,,2,84,ارتوپدی_doctor_117.json,ارتوپدی_doctor_117.json,1
256400,زنان_و_زایمان_doctor_6.json,https://nobat.ir/maryambafi,maryambafi,دکتر مریم بافی قدیمی,زنان ، زایمان و نازایی,متخصصشماره نظام: ۱۱۰۸۹۴,False,,208.0,84.0,4.2,سابقه ۱۵ سال فعالیت در حرفه پزشکی دارای بورد تخصصی فلوشیپ جراحی زیبایی زنان از ارمنستان مدرک هیستروسکوپی وجراحی با لیزر از دانشگاه تهران مدرک لاپاراسکوپی از دانشگاه تهران,1,138,زنان_و_زایمان_doctor_6.json,زنان_و_زایمان_doctor_6.json,1
256556,کلیه_و_مجاری_ادراری_(اورولوژی)_doctor_571.json,https://nobat.ir/12560,12560,دکتر فرشاد گوران,متخصص جراحی کلیه، مجاری ادراری (اورولوژی),فلوشیپشماره نظام: ۱۰۶۱۷۸,False,,106.0,94.0,4.7,دانش آموخته دکتری عمومی دانشگاه تهران فارغ التحصیل تخصص جراحی کلیه و مجاری ادراری دانشگاه ایران فلوشیپ جراحی درون بین کلیه و لاپاروسکوپی دانشگاه ایران (مرکز فوق تخصصی هاشمی نژاد),2,75,کلیه_و_مجاری_ادراری_(اورولوژی)_doctor_571.json,کلیه_و_مجاری_ادراری_(اورولوژی)_doctor_571.json,1
257029,گوش_حلق_و_بینی_doctor_277.json,https://nobat.ir/12612,12612,دکتر محمد علیپور,متخصص گوش و حلق وبینی,متخصصشماره نظام: ۱۰۱۲۲۷,False,,106.0,94.0,4.7,پزشکی عمومی -قزوین تخصص گوش و حلق وبینی-همدان سابقه 19سال طبابت جراحی زیبایی و پلاستیک بینی جراحی زیبایی صورت جراحی زیبایی گوش جراحی سرو گردن (تیروییدو...) جراحی آندوسکوپی سینوس جراحی لوزه و....,1,63,گوش_حلق_و_بینی_doctor_277.json,گوش_حلق_و_بینی_doctor_277.json,1
257364,کلیه_و_مجاری_ادراری_(اورولوژی)_doctor_557.json,https://nobat.ir/doctor/%D8%AF%DA%A9%D8%AA%D8%B1-%D8%B3%DB%8C%D8%AF%D8%B4%D9%87%D8%A7%D8%A8-%D8%A7%D9%84%D8%AF%DB%8C%D9%86-%D8%A7%DB%8C%D8%B2%D8%AF%DB%8C-%D8%AA%D9%87%D8%B1%D8%A7%D9%86/dr-dr.s.sh.izadi/vs-1,dr.s.sh.izadi,دکتر سیدشهاب الدین ایزدی,متخصص جراحی کلیه و مجاری اداری ( ارولوژی ),متخصصشماره نظام: ۱۳۱۰۹۷,False,,160.0,96.0,4.8,,1,96,کلیه_و_مجاری_ادراری_(اورولوژی)_doctor_557.json,کلیه_و_مجاری_ادراری_(اورولوژی)_doctor_557.json,1
258576,مغز_و_اعصاب_doctor_504.json,https://nobat.ir/doctor/%D8%AF%DA%A9%D8%AA%D8%B1-%DA%A9%DB%8C%D8%B3%D8%A7%D9%86-%D9%85%D9%88%D8%B0%D9%86%DB%8C-%D8%AA%D9%87%D8%B1%D8%A7%D9%86/dr-dr.keisan_moazeni/vs-1,dr.keisan_moazeni,دکتر کیسان موذنی,متخصص و جراح مغز و اعصاب - دیسک و ستون فقرات,متخصصشماره نظام: ۱۳۸۵۶۱,False,,477.0,86.0,4.3,بورد تخصصی جراحی مغز واعصاب از دانشگاه تهران جراحی لیزری دیسک کمر و گردن جراحی تنگی کانال نخاعی (کمر و گردن) جراحی انواع تومورهای مغزی جراحی انواع تومور های نخاعی جراحی آندوسکوپیک مغز درمان انواع سردرد درمان انواع بیماری های اعصاب محیطی,3,235,مغز_و_اعصاب_doctor_504.json,مغز_و_اعصاب_doctor_504.json,1
258948,پوست_و_مو_doctor_364.json,https://nobat.ir/12846,12846,دکتر مونا شایگان مهر,متخصص پوست و مو,متخصصشماره نظام: ۱۳۹۷۲۲,False,,29.0,94.0,4.7,متخصص پوست، مو و زیبایی دارای بورد تخصصی از دانشگاه تهران (بیمارستان رازی),3,16,پوست_و_مو_doctor_364.json,پوست_و_مو_doctor_364.json,1
258976,گوش_حلق_و_بینی_doctor_300.json,https://nobat.ir/doctor/%D9%85%D8%B1%DA%A9%D8%B2-%D8%AA%D8%AE%D8%B5%D8%B5%DB%8C-%DA%AF%D9%88%D8%B4-%D8%B3%D8%B1%D9%88%D8%B4-%D8%AA%D9%87%D8%B1%D8%A7%D9%86/dr-soroushclinic/vs-1,soroushclinic,مرکز تخصصی گوش سروش,دکتر افسانه منتظمی,متخصصشماره نظام: ۱۱۰۲۴۶,False,,88.0,96.0,4.8,آدرس سایت: sorooshclinic.ir جامع ترین مرکز تخصصی گوش، سرگیجه و سمعک با بیش از 15 سال سابقه فعالیت کلینیک مرکزی شرکت بهکاران عرصه، شعبه انحصاری کمپانی یونیترون کانادا در ایران به شماره ثبت 200922 و شناسه ملی 10260116098 ویزیت توسط متخصصان گوش و حلق و بینی و فوق تخصص گوش و اساتید دانشگاهی معاینه میکروسکوپیک گوش انجام تمامی آزمون های گوش، سرگیجه و تعادل در تمامی سنین شنوایی سنجی نوزادان و بزرگسالان ارزیابی و توانبخشی وزوز گوش (سوت گوش) تجویز به روز ترین سمعک های دنیا با فاکتور رسمی مورد قبول تمامی بیمه ها ارائه گواهی معتبر جهت بیمه تکمیلی,1,54,گوش_حلق_و_بینی_doctor_300.json,گوش_حلق_و_بینی_doctor_300.json,1
259527,زنان_و_زایمان_doctor_91.json,https://nobat.ir/doctor/%D8%AF%DA%A9%D8%AA%D8%B1-%D8%B3%D9%87%DB%8C%D9%84%D8%A7-%D8%AF%D8%B1%D8%B2%DB%8C-%D8%AE%D9%84%D8%B1%D8%AF%DB%8C-%D8%AA%D9%87%D8%B1%D8%A7%D9%86/dr-soheiladarzi/vs-1,soheiladarzi,دکتر سهیلا درزی خلردی,جراح و متخصص زنان و زایمان و نازایی,متخصصشماره نظام: ۱۰۵۱۸۴,False,,843.0,86.0,4.3,دکتر سهیلا درز ی در هشتم شهریور 1356 در شهرستان بهشهر یکی از شهر های استان مازندران.به دنیا آمد. در دوران تحصیل دانش آموز نمونه و برتر در شهرستان و کشور بوده است. او در سال 1374موفق به کسب رتبه 13 در کنکور سراسری در رشته تجربی شد. و در دانشگاه علوم پزشکی تهران شروع به تحصیل رشته پزشکی کرد. او به مدت 10 سال با مدرک پزشکی عمومی مشغول به کار شد. تا اینکه درسال 1393در رشته جراحی زنان و زایمان در دانشگاه علوم پزشکی شهید بهشتی شروع به گذراندن دوران رزیدنتی خود کرد. در سال 1397 بورد تخصصی خود را دریافت کرد و به مدت 2 سال در شهرستانهای ابهر و خرمدره از توابع استان زنجان دوران طرح خود را گذراند. در این مدت تجربیات زیادی در تخصص خود کسب کرد و سپس در دوره های پیشرفته زیبایی تحت نظر اساتید بزرگ تجربیات خود را کامل کرد.در حال حاضر با تجربه چندین ساله در حال خدمت در چندین درمانگاه شرق تهران و مطب شخصی با بروز ترین تکنولوژی روز است,1,247,زنان_و_زایمان_doctor_91.json,زنان_و_زایمان_doctor_91.json,1
261017,ارتوپدی_doctor_173.json,https://nobat.ir/doctor/%D8%AF%DA%A9%D8%AA%D8%B1-%D8%B9%D9%84%DB%8C-%D8%A8%D9%87%D8%A7%D8%B1%DB%8C-%D8%AA%D9%87%D8%B1%D8%A7%D9%86/dr-dralibahari/vs-1,dralibahari,دکتر علی بهاری,متخصص ارتوپدی ( جراح استخوان و مفاصل ),متخصصشماره نظام: ۱۵۶۳۲۲,False,,152.0,90.0,4.5,درمان اختصاصی دردها و آسیب های زانو و انحرافات زانو طبق آخرین گایدلاین های روز دنیا. متخصص و جراح ارتوپدی. شاغل در بیمارستان فوق تخصصی پیامیران تهران و فرهیختگان تهران. سابقه ی هیئت علمی در مرکز آموزشی و درمانی بیمارستان شهید رجایی قزوین. بیش از ۱۰ سال سابقه ی طبابت در بیمارستان ها و مراکز درمانی دولتی و غیردولتی با بیش از ۱۷۰۰ عمل ارتوپدی موفق. سابقه طبابت در مناطق محروم جنوب. خدمات قابل ارائه: درمان آسیب های ورزشی، آرتروز زانو، تعویض مفصل زانو، آرتروسکوپی، درمان انحرافات زانو از جمله زانوی پرانتزی و زانوی ضربدری، درمان انحراف شست پا یا هالوکس والگوس. نوبت به صورت آنلاین و حضوری. مطب: روزهای زوج (شنبه، دوشنبه، چهارشنبه از ساعت ۱۴ الی ۱۹). ویزیت آنلاین و مشاوره شنبه تا چهارشنبه از ساعت ۱۰ صبح الی ۱۹ امکان پذیر می باشد.,1,91,ارتوپدی_doctor_173.json,ارتوپدی_doctor_173.json,1
261269,مغز_و_اعصاب_doctor_425.json,https://nobat.ir/13048,13048,دکتر مهران آرمان فر,متخصص جراحی مغز و اعصاب دیسک و ستون فقرات,متخصصشماره نظام: ۶۶۰۹۲,False,,554.0,94.0,4.7,,1,257,مغز_و_اعصاب_doctor_425.json,مغز_و_اعصاب_doctor_425.json,1
262889,مغز_و_اعصاب_doctor_492.json,https://nobat.ir/13192,13192,دکتر سید احسان محمدیانی نژاد,متخصص مغز و اعصاب ، فلوشیپ بیماریهای التهابی,فلوشیپشماره نظام: ۵۴۹۹۶,False,,1332.0,96.0,4.8,سوابق: – عضو هیئت علمی و دانشیار دانشگاه علوم پزشکی تهران – فلوشیپ ام اس و بیماریهای التهابی مغز و نخاع – عضو انجمن ام اس کشور – دبیر انجمن سردرد کشور خدمات: – انجام امور تشخیصی و درمانی در کلیه بیماریهای مغز و اعصاب و عضلات – درمان ام اس و بیماریهای التهابی مغز و نخاع – درمان سردرد و سرگیجه های مقاوم به درمان – تزریق بوتاکس در کلیه بیماریهای مغز و اعصاب,1,233,مغز_و_اعصاب_doctor_492.json,مغز_و_اعصاب_doctor_492.json,1
263705,ارتوپدی_doctor_123.json,https://nobat.ir/farzammokarami,farzammokarami,دکتر فرزام مکرمی,متخصص ارتوپدی,فلوشیپشماره نظام: ۱۲۳۰۹۶,False,,380.0,94.0,4.7,- مراجعین گرامی نوبت دهی فقط اینترنتی از طریق سایت دکتریاب ( dryb.ir/4828) یا سایت نوبت هر کدام که فعال بود انجام می شود و نوبت دهی تلفنی میسر نیست. -متخصص ارتوپدی و فوق تخصص جراحی دیسک کمر و گردن. تزریق اپیدورال ستون فقرات برای درمان دیسک و تنگی خفیف تا متوسط کانال نخاعی -درمان روماتیسم مفاصل -ترمیم تاندون و اعصاب محیطی -درمان شکستگی ها و پوکی استخوان -درمان بیماریهای دست و تنگی کانال دست CTS، آرنج و شانه -درمان آسیب های مچ پا -درمان و جراحی دیسک گردن، کمر، عصب سیاتیک و تنگی کانال نخاعی -درمان بیماریهای زانو و جراحی منیسک و رباط صلیبی زانو,1,229,ارتوپدی_doctor_123.json,ارتوپدی_doctor_123.json | مغز_و_اعصاب_doctor_430.json,2
263760,پوست_و_مو_doctor_330.json,https://nobat.ir/13263,13263,دکتر بهناز همدانی,متخصص پوست ، مو ، لیزر و زیبایی,متخصصشماره نظام: ۱۳۹۳۸۴,False,,103.0,94.0,4.7,جراح و متخصص پوست، مو، لیزر و زیبایی رتبه برتر بورد تخصصی کشور تخصص پوست از دانشگاه شهید بهشتی دکترای حرفه ای از دانشگاه تهران عضو انجمن علمی متخصصین پوست ایران درمان بیماریهای پوست، مو و ناخن جراحی ضایعات خوش خیم، کیست، سرطان پوست جراحی ناخن جوانسازی پوست با روشهای مختلف: آراف فرکشنال، لیزرهای جوانسازی، اندولیفت،..... تزریق چربی لیفت با نخ هایفوتراپی جراحی و ساکشن غبغب مزوتراپی پی آر پی تزریق ژل، بوتاکس و... بلفاروپلاستی (جراحی افتادگی پلک) ،....,1,38,پوست_و_مو_doctor_330.json,پوست_و_مو_doctor_330.json,1
263948,زنان_و_زایمان_doctor_45.json,https://nobat.ir/doctor/%D8%AF%DA%A9%D8%AA%D8%B1-%D8%B2%D9%87%D8%B1%D8%A7-%D8%BA%D9%84%D8%A7%D9%85%DB%8C-%D8%AA%D9%87%D8%B1%D8%A7%D9%86/dr-drzahragholami/vs-1,drzahragholami,دکتر زهرا غلامی,متخصص و جراح زنان و زایمان و نازایی,متخصصشماره نظام: ۸۸۹۵۱,False,,130.0,90.0,4.5,جراح و متخصص بیماری های زنان، زایمان و نازایی تشخیص و درمان زگیل تناسلی کولپوسکوپی کرایوتراپی برداشتن زگیل تناسلی لابیاپلاستی تنگ کردن واژن سفید کردن واژن تزریق فیلر و ژل بیکینی جراحی افتادگی واژن و مثانه درمان عفونتهای مقاوم وتکرار شونده تناسلی درمان تبخال تناسلی,2,88,زنان_و_زایمان_doctor_45.json,زنان_و_زایمان_doctor_45.json,1
264228,پوست_و_مو_doctor_402.json,https://nobat.ir/13295,13295,دکتر ربابه غیبی,متخصص پوست و مو زیبایی,متخصصشماره نظام: ۶۸۲۵۱,False,,92.0,90.0,4.5,,1,60,پوست_و_مو_doctor_402.json,پوست_و_مو_doctor_402.json,1
264420,زنان_و_زایمان_doctor_65.json,https://nobat.ir/doctor/%D8%AF%DA%A9%D8%AA%D8%B1-%D8%A2%D9%85%D9%86%D9%87-%D8%B1%D9%86%D8%AC%D8%A8%D8%B1-%D8%AA%D9%87%D8%B1%D8%A7%D9%86/dr-amenehranjbar/vs-1,amenehranjbar,دکتر آمنه رنجبر,متخصص زنان و زایمان ، فلوشیپ طب مادر و جنین (پریناتولوژیست),فلوشیپشماره نظام: ۱۴۲۹۵۴,False,,42.0,96.0,4.8,فارغ التحصیل پزشکی عمومی از دانشگاه علوم پزشکی تهران دارای بورد تخصصی جراحی زنان وزایمان فلوشیپ طب مادر و جنین (پریناتولوژی- بارداری پرخطر) از دانشگاه علوم پزشکی ایران انجام جراحی های زیبایی زنان مانند: لابیاپلاستی و پرینئوپلاستی، تزریق ژل و بوتاکس، ریداکشن لابیاماژور هودوپلاستی و ..... راه ارتباطی با واتزاپ: 09194578578 راه ارتباطی با اینستاگرام: dr.amenehranjbar آدرس سایت: dramenehranjbar.ir,1,32,زنان_و_زایمان_doctor_65.json,زنان_و_زایمان_doctor_65.json,1
266689,گوش_حلق_و_بینی_doctor_285.json,https://nobat.ir/dr.kalani,dr.kalani,دکتر میر مصطفی کلانی,متخصص گوش و حلق و بینی جراح زیبایی بینی و صورت,متخصصشماره نظام: ۳۲۴۲۱,False,,136.0,90.0,4.5,فارغ التحصیل دکترای پزشکی از دانشگاه اصفهان ۱۳۶۹ بورد تخصص گوش و حلق و بینی و جراحی سر و گردن از دانشگاه ترکیه ۲۰۰۳ سابقه فعالیت به عنوان متخصص گوش و حلق و بینی و جراح پلاستیک بینی و صورت در ترکیه و همچنین جراح آندوسکوپی سینوس و پلاستیک صورت در اتریش عضو انجمن رینوپلاستی و جراحی سینوس,1,79,گوش_حلق_و_بینی_doctor_285.json,گوش_حلق_و_بینی_doctor_285.json,1
266926,ارتوپدی_doctor_140.json,https://nobat.ir/13562,13562,دکتر محمدرضا سرشار,فلوشیپ جراحی پا و مچ پا ، متخصص ارتوپدی,فلوشیپشماره نظام: ۱۴۱۷۶۶,False,,375.0,94.0,4.7,دکتر محمدرضا سرشار فارغ التحصیل پزشکی عمومی از دانشگاه علوم پزشکی ایران ورودی سال ۹۲ تخصص جراحی استخوان و مفاصل.فارغ التحصیل دوره تخصص از دانشگاه علوم پزشکی ایران در سال۹۸.دارای بورد تخصصی درمان انواع شکستگیها و آسیبهای ورزشی تعویض مفصل بعد ار آن ۲ سال دوره ی فلوشیپی جراحی پا ومچ پا گذرانده اند و اولین فارغ التحصیل فوق تخصصی جراحی مچ پا در ایران میباشند,1,231,ارتوپدی_doctor_140.json,ارتوپدی_doctor_140.json,1
268719,مغز_و_اعصاب_doctor_483.json,https://nobat.ir/doctor/%D8%AF%DA%A9%D8%AA%D8%B1-%D9%85%D8%B1%D8%AA%D8%B6%DB%8C-%D8%A7%D8%B4%D8%B1%D8%A7%D9%81%DB%8C-%D8%AA%D9%87%D8%B1%D8%A7%D9%86/dr-morteza.ashrafi/vs-1,morteza.ashrafi,دکتر مرتضی اشرافی,متخصص جراحی مغز و اعصاب و ستون فقرا/جراحی اعصاب کودکان,متخصصشماره نظام: ۱۲۳۱۲۳,False,,113.0,94.0,4.7,دکتر مرتضی اشرافی جراح مغز و اعصاب و ستون فقرات دارای بورد تخصصی جراحی مغز و اعصاب و ستون فقرات فلوشیپ جراحی ستون فقرات و مغز کودکان از دانشگاه تهران تشخیص و جراحی انواع تومور مغزی تشخیص و درمان تومورهای ستون فقرات تشخیص و درمان جراحی و غیر جراحی دیسک کمر درمان و جراحی شکستگی مهره ستون فقرات درمان انواع تروما و ضربه و شکستگی جمجمه درمان و جراحی سندرم کارپال تونل درمان بیماریهای جراحی اعصاب کودکان شامل تومورها، هیدروسفالی، کرانیوسینوستوز (بدشکلی جمجمه) و ضایعات مادرزادی ستون فقرات ونخاع,1,71,مغز_و_اعصاب_doctor_483.json,مغز_و_اعصاب_doctor_483.json,1
269066,ارتوپدی_doctor_146.json,https://nobat.ir/13742,13742,دکتر آرین برادران جمیلی,فلوشیپ جراحی زانو و متخصص ارتوپدی,فلوشیپشماره نظام: ۱۳۸۲۲۰,False,,109.0,94.0,4.7,فلوشیپ فوق تخصصی جراحی زانو متخصص ارتوپدی,2,71,ارتوپدی_doctor_146.json,ارتوپدی_doctor_146.json,1
270048,کلیه_و_مجاری_ادراری_(اورولوژی)_doctor_532.json,https://nobat.ir/13824,13824,دکتر سیدبهنام نصیحت کن,متخصص ارولوژی ، فلوشیپ ارولوژی کودکان,فلوشیپشماره نظام: ۱۲۸۸۹۲,False,,122.0,96.0,4.8,متولد ۱۳۶۳ دانش آموخته مدارس تیزهوشان در مقاطع راهنمایی و دبیرستان (علامه حلی تهران و شهید دستغیب شیراز) رتبه ۱۹۰ کنکور سراسری ورودی سال ۱۳۸۱ رشته پزشکی دانشگاه علوم پزشکی شیراز ورودی سال ۱۳۸۹ تخصص جراحی کلیه و مجاری ادراری (ارولوژی) دانشگاه علوم پزشکی شیراز بورد تخصصی ارولوژی فلوشیپ فوق تخصصی جراحی کلیه و مجاری ادراری کودکان از دانشگاه علوم پزشکی تهران، مرکز طبی کودکان تشخیص و درمان جراحی و دارویی انواع بیماری های کلیه، مثانه، حالب، پروستات، مجرا، بیضه، ختنه، هایپوسپادیاس، انواع فتق و ... در بزرگسالان و کودکان اعمال ترمیمی و زیبایی دستگاه تناسلی در بانوان (لابیاپلاستی)، کودکان و آقایان کرایوتراپی (فریز کردن) زگیل های تناسلی و دیگر ضایعات پوستی درمان اختلالات دفعی کودکان، شب ادراری، بی اختیاری و ...,2,77,کلیه_و_مجاری_ادراری_(اورولوژی)_doctor_532.json,کلیه_و_مجاری_ادراری_(اورولوژی)_doctor_532.json,1
