task_id,item_id,text_label,label_human,bucket,specialty,rate,is_duplicate,label_human_note,rater_id,label_human_int
task01_00020,sent_002216,برای درمان لغزش دست مراجعه کردم ولی هنوز نتیجه نگرفتم,-1.0,high_neg,متخصص بیماری های مغز و اعصاب و ستون فقرات,2.5,0,,,-1.0
task01_00065,sent_002229,تا کنون در حال دوره درمان و به نسبت به گذشته بهترم,0.0,rate_neg,متخصص جراحی مغز و اعصاب,2.5,0,,,0.0
task01_00012,sent_002234,برای درمان آکنه مراجعه کردم از نظر برخورد و اخلاق خانم دکتر و تشخیص رضایت دارم ولی برنامه کارشون در کلینیک بهار اصلا مناسب نیست و برای وقت مراجعین ارزشی قائل نیستن بیش از ظرفیت کاری پزشک پذیرش میکنن و ساعات ویزیت و جراحی از هم تفکیک نشده برای یه ویزیت ساده و نشون دادن جواب آزمایش بیش از 2 ساعت معطلی داره,-1.0,high_neg,متخصص پوست و مو و زیبایی ، لیزر,2.5,0,,,-1.0
task01_00059,sent_002239,آقای دکتر درباره بیماری ونوع تشخیص بیماری اصلا توضیح نمیده ما ازش راضی نبودیم,-1.0,rate_neg,فلوشیپ جراحی ستون فقرات,2.5,0,,,-1.0
task01_00112,sent_002262,مطب بسیار شلوغ و معطلی بسیار زیاد,-1.0,high_neg,متخصص گوش حلق بینی,2.5,0,,,-1.0
task01_00269,sent_002267,دیسک کمر داشتم گفتن عمل کنین فشارم بالابودن نشده عمل کنم میخوام نوبت برای عمل بزنم,0.0,service_neg,متخصص جراحی مغز و اعصاب,2.5,0,,,0.0
task01_00103,sent_002289,یکبار توسط ایشون ویزیت شدم وعالی بودن,1.0,topup_pref,فلوشیپ طب مادر و جنین - پریناتولوژی,5.0,0,,,1.0
task01_00828,sent_002294,خوب ولی مطب خیلی بی‌نظم و شلوغ هست,0.0,high_neg,متخصص زنان و زایمان - فلوشیپ نازایی,2.5,1,,,0.0
task01_00000,sent_002350,برای بعضی بیماران وقت می‌گذاشتند و از پشت در مطب می‌شنیدم که یک مطلب را چند بار برای بیمار تکرار می‌کردند ولی من که وارد مطب شدم وقت چندانی نگذاشتند و با عجله و نسبتا بی‌حوصلگی برخورد کردند و جواب‌های تند و سرسری دادند,-1.0,high_neg,فلوشیپ جراحی ستون فقرات,2.5,0,,,-1.0
task01_00186,sent_002376,مراحل اولیه درمان,0.0,rate_neg,متخصص پوست ، مو ، زیبایی,2.5,0,,,0.0
task01_00025,sent_002410,تشنج دارم و هنوز هم درمان نشده,-1.0,high_neg,فلوشیپ صرع و متخصص بیماریهای مغز و اعصاب و ستون فقرات,2.5,0,,,-1.0
task01_00206,sent_002428,خیلی خوب بود,1.0,random,متخصص مغز و اعصاب و ستون فقرات,5.0,0,,,1.0
task01_00231,sent_002441,من برای بارداری اولم و اقدامات قبل از بارداری به خانم دکتر مراجعه کردم و تا الان خیلی راضی هستم خانم دکتر بسیار با آرامش هستند و این آرامش رو به مراجعه‌کننده هم میدن بسیار متخصص هستند و یک نکته‌ی بسیار عالی که در مورد ایشون هست اینه که وضعیت مالی مراجعه‌کننده رو مدنظر میگیرن برای تجویزهایی که میکنن مخصوصا در مورد بارداری که هزینه‌ها بیشتر هست مواردی که واقعا لازم هست شما رو میفرستن که انجام بدین وقتی داخل اتاق پیش شون هستین با حوصله به صحبت تون گوش میدن و به هیچ وجه عجله‌ای ندارن و بسیار وقت میذارن بنظرم ارامش مهم‌ترین چیزی هست که مادر باردار لازم داره و خانم دکتر اینو خیلی خوب در اختیار شما میذارن با تخصص و روحیه‌ی اروم شون,1.0,mixed,جراح و متخصص زنان و زایمان,5.0,0,,,1.0
task01_00013,sent_002443,کمرد و ستون فقرات,0.0,rate_neg,جراح مغز و اعصاب و ستون فقرات,2.5,0,,,0.0
task01_00014,sent_002532,برای گلو درد و گوش‌درد رفتم,0.0,topup_pref,متخصص گوش حلق بینی و جراحی های سرو و گردن .جراحی زیبایی صورت,2.5,0,,,0.0
task01_00096,sent_002533,مشکل پرزوستات داشتم که به کمک ایشان و استفاده از داروهای سنتی بهبود یافتم,1.0,topup_pref,فلوشیپ پیوند کلیه ، عضو تیم تخصصی درمان ناباروری,2.5,1,,,1.0
task01_00219,sent_002553,خیلی خوش‌اخلاق و با حوصله هنوز درمان نشدم ولی از رفتارشون راضی هستم,1.0,high_neg,متخصص گوش و حلق و بینی و جراحی سر و گردن و جراحی زیبایی بینی,2.5,0,,,1.0
task01_00307,sent_002559,شوره پوست سر داروهایی تجویز کردند که موثر بود ولی دو ماه بعد از پایان مصرف دارو باز شوره برگشته و میخوام دوباره مراجعه کنم,0.0,rate_neg,متخصص پوست ، مو ، زیبایی و لیزر,2.5,0,,,0.0
task01_00136,sent_002566,کیست داشتم هنوز پیگیرم,0.0,rate_neg,فلوشیپ انکولوژی زنان ( سرطان شناسی ),2.5,0,,,0.0
task01_00173,sent_002573,تحت درمان قرار دارم,0.0,topup_pref,فلوشیپ پیوند کلیه ، عضو تیم تخصصی درمان ناباروری,2.5,0,,,0.0
task01_00320,sent_002587,پزشک خوبی هستن در حال درمان هستم,1.0,topup_pref,متخصص زنان و زایمان ( فلوشیپ نازایی )، IVF و لاپاراسکوپی,2.5,0,,,1.0
task01_00024,sent_002603,بسیار با حوصله ودقیق هستن شش ماه ترشح خون از بینی داشتم با یک ویزیت خوب شدم,1.0,topup_pref,متخصص گوش و حلق و بینی,5.0,0,,,1.0
task01_00033,sent_002635,دو بار ویزیت شدم هر بار بیش از 5 ساعت در مطب منتظر بودم,-1.0,high_neg,جراح ارتوپد,2.5,0,,,-1.0
task01_00254,sent_002639,برای مورد خیلی پیچیده مراجعه نکردم ولی خیلی با بی‌حوصلگی پاسخ گرفتم شاید چون مورد معمولی بود شاید هم اونروز خسته بودن ولی راهکار خاصی پیشنهاد نشد یا نظر مشاوره‌ای خاص,0.0,rate_neg,متخصص پوست ، مو و زیبایی و لیزر,2.5,0,,,0.0
task01_00270,sent_002645,دکتر بسیار بسیار عالی است اگر تو عمل هاش توان دیگران را در نظر بگیرد عالی میشه,1.0,mixed,جراح ارتوپد ،فلوشیپ لگن ، ران ، تعویض مفصل,5.0,0,,,1.0
task01_00310,sent_002666,عمل برداشت رحم,0.0,rate_neg,متخصص زنان و زایمان,2.5,0,,,0.0
task01_00285,sent_002680,دکتر با تجربه‌ای بود کیست داشتم که دارو دادن کمی بهتر شد,1.0,rate_neg,متخصص ارتوپدی,2.5,0,,,1.0
task01_00088,sent_002711,نظم مطب و وقت دهی بسیار عالی برخورد خانم دکتر و صبر ایشون بسیار و توضیحات با کمال آرامش بسیار راضی هستم,1.0,topup_pref,جراح و متخصص زنان و زایمان و نازایی,5.0,0,,,1.0
task01_00273,sent_002713,تلت 33,0.0,rate_neg,متخصص پوست و مو و زیبایی و لیزر,2.5,0,,,0.0
task01_00263,sent_002714,بسیار دکتر خوب وتشخیص عالی برای بیماری فشار مغز داشتند وبا دارو خیلی بهتر هستم وچند ماه تحت نظر ایشان هستم,1.0,high_pos,متخصص مغز و اعصاب ( نورولوژی ),5.0,0,,,1.0
task01_00204,sent_002723,سلام من پای پرانتزی داشتم با درجه بالا پای راستم 23 درجه و پای چپم 19 درجه که سال گذشته 98 از طریق اینترنت با ایشون آشنا شدم با اولین ویزیت در مطب ایشون تصمیم گرفتم ایشون پای راستمو جراحی کنن خرداد ماه جراحی کردم بسیار راضی بودم ایشون با صبر با اخلاق با حوصله در تمام لحظات کنارم بودن و جوابگو مشکلاتم خیلی زود نتیجه گرفتم و پای چپم جراحی کردم الحمدالله درد شدید و سختی نداره فقط روز اول نهایت هفته اول اذیت شدم با توجه بدستورات بعد از جراحی و اجرا آنها خیلی زود مشکلاتم حل شدن و پا هام راست و بسیار عالی خوب شدم من بسیار بسیار از ایشون و دستیارشون سرکار خانم دانا ممنونم وجود پربرکتشون همیشه سلامت و سعادتمند در پناه حق باشد ان شاالله,1.0,service_neg,متخصص جراحی استخوان و مفاصل(ارتوپد),5.0,0,,,1.0
task01_00240,sent_002738,زانودرحال درمان,0.0,rate_neg,جراح و متخصص ارتوپدی,2.5,0,,,0.0
task01_00039,sent_002762,جناب دکتر اسحاقی یکی از بهترین وبا وجدان‌ترین دکتری است که تا به حال دیدم خدا پشت وپناه خودش وخانواده باشه,0.0,high_pos,جراح مغز و فلوشیپ دیسک و ستون فقرات,5.0,0,,,0.0
task01_00099,sent_002824,برای باراول خوب بود,0.0,topup_pref,متخصص بیماری های پوست و مو,2.5,0,,,0.0
task01_00142,sent_002848,عمل بینی عاای,0.0,random,متخصص و جراح گوش و حلق و بینی,5.0,0,,,0.0
task01_00246,sent_002854,با توصیه یکی از آشنایان به مطب ایشان مراجعه نمودم از لحظه‌ای که آمده‌ام احساس نشاط و تندرستی و سلامت و ایمنی کامل احساس می‌کنم این چیزی جز رسالت و تعهد یک پزشک مسئول و دلسوز و مجرب نمی‌باشد بدین وسیله بر خود فرضی واجب می‌دانم که از زحمات نامبرده و پرسنل فداکار و مهربان این مجموعه تقدیر و سپاس گزارم با تقدیم احترامات فائقه نورایی نژاد,1.0,service_neg,متخصص مغز و اعصاب ( نورولوژیست ),5.0,0,,,1.0
task01_00152,sent_002859,برای بار دوم مراجعه می‌کنم,0.0,rate_neg,متخصص جراحی استخوان و مفاصل ارتوپدی,2.5,0,,,0.0
task01_00053,sent_002869,دکتر خوبی هستن و خوب بود کارشون ولی من فقط دوره درمان و مصرف داروها اثر بهبودی رو دیدم و بعدش مثله قبل شد باز,0.0,rate_neg,متخصص پوست و مو,2.5,0,,,0.0
task01_00257,sent_002946,سلام خیلی خوب بود,1.0,rate_neg,فلوشیپ انکولوژی زنان ، لاپاروسکوپی و کولپوسکوپی,2.5,0,,,1.0
task01_00172,sent_002948,سلام دکتر خوبی بود و پاسخگویی خوبی داشت ولی زمان معطلی زیاد بود من 4 20 دقیقه وقت گرفته بودم ولی ساعت 6 نوبتم شد,0.0,high_neg,جراح استخوان و مفاصل و ستون فقرات,2.5,1,,,0.0
task01_00213,sent_002953,عالی ولی بسیار شلوغه ومعطلی داره,1.0,mixed,متخصص جراحی مغز و اعصاب,5.0,1,,,1.0
task01_00067,sent_002972,پارگی دیسک کمر ویزیت اولیه شدم با توجه به درد کمرم تایم نوبت دهی خوب بود و زیاد منتظر نموندم که خیلیی برام مهم بود این موضوع و خود دکتر خیلی خیلی با سواد و حرفه‌ای امیدوارم زودتر خوبشم,1.0,mid_neg,متخصص جراحی مغز و اعصاب و ستون فقرات,5.0,0,,,1.0
task01_00771,sent_002987,با سلام ایشون دکتر خیلی خوبی هستن تنها مشگل منتظر نوبت موندن در مطب هستش,1.0,high_neg,جراح و متخصص زنان، زایمان,2.5,0,,,1.0
task01_00150,sent_002988,فعلا منتظر جواب ازمایشم هستم,0.0,high_neg,جراح و متخصص زنان و زایمان و نازایی,2.5,0,,,0.0
task01_00199,sent_003018,من وهمسرم ودخترم ناراحتی آرتروزگردن وزانوودرد مفاصل داشتیم وداریم دکترمیبایستی وقت بیشتری برای بیماربگذارد فقط ایشان داروهای خوبی تجویزمیکند,0.0,rate_neg,متخصص ارتوپدی,2.5,0,,,0.0
task01_00275,sent_003059,فعلا که کامل نبوده,0.0,rate_neg,متخصص پوست ، مو و لیزر,2.5,1,,,0.0
task01_00238,sent_003074,سر اون تایمی که نوبت داشتم ویزیت نشدم یک ساعت ربع منتظر موندم تا ویزیت بشم,0.0,high_neg,متخصص پوست و مو (درماتولوژی),2.5,0,,,0.0
task01_00002,sent_003077,ناشناوای تلفن,0.0,service_neg,جراح گوش و حلق و بینی,2.5,0,,,0.0
task01_00235,sent_003098,بنده باردارم هستم و پیش ایشون ویزیت میشم عالی هستن هم خود دکتر هم محیط تمیزشون هم منشی عالیشون,1.0,topup_pref,متخصص زنان زایمان و نازایی,5.0,0,,,1.0
task01_00007,sent_003116,خوب مت,1.0,rate_neg,متخصص پوست و مو,2.5,0,,,1.0
task01_00049,sent_003125,معطلی مطب بشدت زیاد بود من دوساعت معطل شدم و واقعا ناراحت شدم ولی خانم دکتر خودش عالی بودن,0.0,mixed,جراح و متخصص زنان زایمان و نازایی,5.0,0,,,0.0
task01_00766,sent_003126,کاش دستگاه سونو دا,0.0,high_neg,متخصص زنان و زایمان,2.5,0,,,0.0
task01_00068,sent_003134,بعدا میگم,0.0,rate_neg,متخصص و جراح زنان و زایمان و نازایی,2.5,0,,,0.0
task01_00126,sent_003168,پارگیه مینیسک زانو دکتر خیلی خوبیه فقط قرار بود واسم وقت جراحی بزارن ولی مسولش کم‌کاری میکنه,0.0,rate_neg,فلوشیب زانو و آسیبهای ورزشی شانه و زانو,2.5,1,,,0.0
task01_00466,sent_003180,خیلی دکتر خوش‌برخورد و مهربونی هستن وبه سوالات هم جواب میدن فقط منشی که اونجا بود بی اعصابه و درست جواب نمیده,1.0,high_neg,جراح و متخصص زنان و زایمان و نازایی,2.5,0,,,1.0
task01_00171,sent_003186,من برای ناباروری مراجعه کردم و نتیجه نگرفتم,-1.0,high_neg,متخصص زنان و زایمان,2.5,0,,,-1.0
task01_00467,sent_003200,دکتر خوب و خوش‌برخورد ولی منشی مطب فردیس نوبت دهی رو نمیتونه مدیریت کنه و معطلی زیاد داده,1.0,high_neg,فلوشیپ اندویورولوژی و لاپاراسکوپی - متخصص و جراح کلیه و مثانه,2.5,0,,,1.0
task01_00175,sent_003255,دکتر با حوصله و خوش‌اخلاق هستند در مورد کارشون نمیتونم نظر یدم چون دوبار فقط ویزیت شدم و درمانم ادامه داره,0.0,service_neg,متخصص پوست ، مو ، زیبایی و لیزر,2.5,0,,,0.0
task01_00267,sent_003259,دو ماه پیش مدت دو ماه پی در پی برای درمان آرتروز زانو پی ار پی انجام دادم درد کم شده اما خوب نشدم,0.0,rate_neg,متخصص ارتوپدی ( جراحی استخوان و. مفاصل ),2.5,0,,,0.0
task01_00436,sent_003310,درد کنار زانو داشتم که بهتر نشد,-1.0,high_neg,جراح ارتوپد ،فلوشیپ لگن ، ران ، تعویض مفصل,2.5,0,,,-1.0
task01_00423,sent_003331,سلام من تحت نظر ایشون هستم خیلی اخلاق جالب ندارن و بمن توهین کردن درمورد مهارتشون چیزی نمیتونم بگم هنوز,-1.0,high_neg,فلوشیپ ناباروری,2.5,0,,,-1.0
task01_00117,sent_003343,خیلی تایم نذاشتن راضی نبودم آزمایش هامم اصلا دقت نکردن,-1.0,high_neg,زنان ، زایمان و نازایی,2.5,0,,,-1.0
task01_00252,sent_003350,سلام آقای دکتر خوش‌برخورد وبا حوصله و همچنین پرسنل خوب هزینه بالا تحت درمان ایشان هستم,1.0,mid_neg,متخصص ارتوپدی و جراحی مفاصل و استخوان,5.0,1,,,1.0
task01_00119,sent_003368,با عرض سلام من یک نوبت امدم یک اسکن نوشته‌شده و سری بعد جواب را اوردم و دو نوبت ویزیت شدم,0.0,service_neg,متخصص ارتوپدی ( جراحی استخوان و مفاصل ),2.5,0,,,0.0
task01_00100,sent_003383,به تازگی ویزیت شدم,0.0,service_neg,متخصص گوش و حلق و بینی و جراحی سر و گردن,2.5,0,,,0.0
task01_00241,sent_003406,داروی تجویزی ایشان بیماری پوستی مرا کاهش داد اما یک جعبه قرص کلاژن ساز گرانقیمت هم تجویز کردند که ربطی به بیماری من نداشت ظاهرا به نفع داروخانه کار می‌کنند نه بیمار,-1.0,high_neg,متخصص پوست ، مو ، زیبایی,2.5,0,,,-1.0
task01_00209,sent_003432,مشکل گلو درد داشتم حل نشد,0.0,rate_neg,متخصص گوش حلق بینی,2.5,0,,,0.0
task01_00306,sent_003498,با سلام نوبت در این مطب اینترنتی هست و تایم مشخص می‌کند ولی وقتی سر وقت حاضر می‌شوید باید طبق حضور بیماران ویزیت شوید بعد از تایم خیلی زیادی که منتظر می‌مانید دکتر با عجله و بدون توجه به شرح‌حال ویزیت می‌کند,-1.0,high_neg,فلوشیپ جراحی شانه و آرنج,2.5,0,,,-1.0
task01_00260,sent_003588,یه توده در گلو ولی هنوز نتیجه نگرفتم احتمالا بعد MRI فعلا نظر خواهی درست نیست,0.0,high_neg,جراح گوش ، حلق و بینی,2.5,0,,,0.0
task01_00194,sent_003602,اصلا راضی نبودم من با دوسه تا اکنه مراجعه کردم بهم راکوتان دادن کبدم اسیب دید,-1.0,high_neg,متخصص پوست و مو,2.5,0,,,-1.0
task01_00301,sent_003628,پزشک خوبی هستن ولی ماماهایی که توی مطبشون کار میکنن اصلا به حریم شخصی احترام نمیذارن,0.0,service_neg,فلوشیپ آی وی اف و لاپاراسکوپی,2.5,0,,,0.0
task01_00062,sent_003640,ویزیت اولیه بود و هنوز درمان تکمیل نشده,0.0,service_neg,جراح و متخصص ارتوپدی و فلوشیپ ارتوپدی کودکان,2.5,1,,,0.0
task01_00321,sent_003644,بیشتر برای زیبایی بینی خوب هستند,0.0,rate_neg,متخصص گوش و حلق و بینی,2.5,0,,,0.0
task01_00029,sent_003658,پروستات هنوزدرحال درمان هستم,0.0,rate_neg,جراح کلیه، مجاری ادراری، تناسلی و پروستات ، اورولوژی,2.5,0,,,0.0
task01_00132,sent_003664,سلام هف,0.0,rate_neg,جراح و متخصص زنان ، زایمان و نازایی,2.5,0,,,0.0
task01_00047,sent_003680,من تاکید کردم ب اینکه عمل نمیخام بشم ولی منو فرستادن اکو نوار قلب و ریه کاره اشتباهی بود فقط هزینه بیخود,-1.0,high_neg,متخصص و جراح مغز اعصاب و ستون فقرات,2.5,0,,,-1.0
task01_00292,sent_003687,مشکل درد کلیه,0.0,rate_neg,جراح و فلوشیپ سرطان شناسی کلیه و مجاری ادراری ( اوروانکولژیست),2.5,0,,,0.0
task01_00215,sent_003713,فعلا یک جلسه رفتم,0.0,rate_neg,جراح کلیه مجاری ادراری پروستات و ناباروری,2.5,0,,,0.0
task01_00125,sent_003726,سلام من پسرم را برم که پیش خیلی دکترها برده بودم ونتیجه نگرفتم وخیلی نگران بودم البته الان هم هستم ولی دکتر گفتند که پسرم تا 18 سالگی باید صفحه رشد بسته شود تا ما شروع به کار کنیم,0.0,high_neg,متخصص ارتوپدی . فلوشیپ جراحی شانه و آرنج,5.0,0,,,0.0
task01_00278,sent_003751,خیلی سرسری وزیت کردن و شرحی در مورد بیماری ندادن فقط اسرار بر عمل داشتن راضی نبودم اصلا,-1.0,high_neg,متخصص ارتوپد و جراح شانه لگن و زانو,2.5,0,,,-1.0
task01_00640,sent_003752,راضی نبودم خیلی دکتر عجولی هست,-1.0,high_neg,متخصص ارتوپدی - تعویض مفصل,2.5,0,,,-1.0
task01_00274,sent_003796,من برای وز وز گوشم رفته بودم پیششون ولی اصلا مدارک منو نگاه نکردن و فقط گفتن باید انژیو بشید,-1.0,rate_neg,متخصص جراحی مغز و اعصاب ، فلوشیپ نورواینترونشن,2.5,0,,,-1.0
task01_00569,sent_003813,اونجور که تعریف کرده بودن همه نبودن و خیلی معمولی بود راجب بیماری که دارید به زور باید توضیح بدن و داروهای خیلی معمولی میدن در کل اونقد راضی نبودم,-1.0,high_neg,جراح و متخصص استخوان و مفاصل { ارتوپد },2.5,0,,,-1.0
task01_00217,sent_003829,یکبار ویزیت شدم فعلا نتیجه نگرفتم,0.0,high_neg,متخصص گوش و حلق وبینی,2.5,0,,,0.0
task01_00679,sent_003838,دیسک کمر منتها هنوز درمان نشده,-1.0,high_neg,جراح مغز و فلوشیپ دیسک و ستون فقرات,2.5,0,,,-1.0
task01_00138,sent_003851,من ویزیت نشدم ولی همینطوری بهشون معمولی نظر دادم,0.0,service_neg,متخصص پوست و مو,2.5,0,,,0.0
task01_00030,sent_003897,مشکل خواب بهتر شدند,0.0,rate_neg,متخصص مغز و اعصاب و ستون فقرات,2.5,0,,,0.0
task01_00223,sent_003912,بسیار دکتر خوبی هستند ولی در نسخه نوشتن و تاریخ زدن باید دقت بیشتری بکنند,1.0,topup_pref,فوق تخصص مغز و اعصاب کودکان,2.5,0,,,1.0
task01_00155,sent_003959,لیزر تتو انجام دادم فعلا منتظر نتیجه‌ام,0.0,high_neg,متخصص پوست و مو,2.5,0,,,0.0
task01_00279,sent_003962,من به چند دکتر مراجعه کرده بودم و اونها با تشخیص اشتباه خیلی منو ترسوندن ولی خانم دکتر کریم پوربا تشخیص عالی و بسیاار با حوصله و آرامش مشکلم رو برام توضیح دادند هنوز تحت درمان هستم,1.0,mixed,جراح و متخصص بیماریهای زنان و زایمان,5.0,0,,,1.0
task01_00237,sent_004041,عالی بود من تزریق فیلر انجام دادم و فوق‌العاده بود,1.0,high_pos,متخصص پوست و مو,5.0,0,,,1.0
task01_00486,sent_004120,پروستات پدر فعلا پت اسکن نوشتن ومنتظر دیدن جواب ونظرشون هستیم,0.0,high_neg,متخصص جراحی کلیه و مجاری ادراری ( اورولوژی),2.5,0,,,0.0
task01_00128,sent_004135,زیاد راضی نبودم,0.0,high_neg,متخصص مغز و اعصاب و ستون فقرات,2.5,0,,,0.0
task01_00092,sent_004138,چکاپ عمومی,0.0,topup_pref,جراح و متخصص زنان و زایمان ، نازایی,2.5,0,,,0.0
task01_00094,sent_004230,فعلا درمانم کامل نشده,0.0,rate_neg,متخصص پوست و مو,2.5,0,,,0.0
task01_00491,sent_004255,فعلا تحت درمان 4 ماهه نتیجه نگرفتم هنوز,-1.0,high_neg,جراح و متخصص زنان زایمان و نازایی,2.5,0,,,-1.0
task01_00048,sent_004257,خوب و مثبت,1.0,rate_neg,جراح و متخصص زنان و زایمان و نازایی,2.5,0,,,1.0
task01_00183,sent_004364,در جلسه اول دکتر خوبی به نظر می‌رسیدن,0.0,rate_neg,متخصص پوست و مو ، زیبایی و لیزر,2.5,0,,,0.0
task01_00151,sent_004401,پی آر پی فعلا درمان ادامه دارد,0.0,rate_neg,متخصص ارتوپدی فلوشیپ جراحی زانو,2.5,0,,,0.0
task01_00222,sent_004419,اولین بار بود مراجعه کردیم مشکلی که هیچ دکتری تشخیص نداده بودو تو ویزیت اول تشخیص دادن با یه نسخه همسرم خدا رو شکر خوب شدن خانم دکتر فوق العاده عالی وحاذق درکارشون هستن وقت برای بیمار میزاره الهی خدا سلامتی به ایشون بده ما پیش چندین متخصص رفتیم وبا تشخیص اشتباه ودارو‌های اشتباه همسرم بدتر شده بود ولی خانم دکتر با یه نسخه درمان کردن,1.0,mixed,متخصص پوست ، مو ، زیبایی و لیزر,5.0,0,,,1.0
task01_00288,sent_004433,فعلآ ویزیت شدم,0.0,service_neg,متخصص جراحی مغز و اعصاب,2.5,0,,,0.0
