task_id,item_id,text_label,label_human,bucket,specialty,rate,is_duplicate,label_human_note,rater_id,label_human_int
task01_00135,sent_004438,انحراف پا تحت درمان,0.0,topup_pref,جراح و متخصص ارتوپدی و فلوشیپ ارتوپدی کودکان,2.5,0,,,0.0
task01_00107,sent_004462,تحت درمان ه,0.0,topup_pref,جراح ارتوپد و فلوشیپ جراحی دست-شانه ،ارنج,2.5,0,,,0.0
task01_00078,sent_004519,مشکل سائیدگی زانوداشتم باسه نوبت تزریق الان خوبم,1.0,topup_pref,متخصص و جراح ارتوپدی,5.0,0,,,1.0
task01_00077,sent_004526,هیچ نتیجه نگرفتیم فعلا,-1.0,rate_neg,متخصص مغز و اعصاب (نورولوژی),2.5,0,,,-1.0
task01_00618,sent_004534,فعلا نتیجه نگرفتم,0.0,high_neg,فلوشیپ جراحی گوش,2.5,0,,,0.0
task01_00239,sent_004566,فللا برای نظر دهی زود است,0.0,rate_neg,جراح استخوان و مفاصل - فلوشیپ جراحی زانو,2.5,0,,,0.0
task01_00031,sent_004617,سلام معاینه داشتم خوب بود,1.0,topup_pref,متخصص زنان و زایمان,2.5,0,,,1.0
task01_00102,sent_004636,کیست داشتم و عمل کردم واقعا ممنونم ازشون,1.0,random,متخصص زنان و زایمان,5.0,0,,,1.0
task01_00055,sent_004654,خانم دکتر بسیار خوش‌برخورد و با حوصله و در ضمن با علم بالا به روزترین خدمات رو ارائه میدن بنده خیلی پیش ایشون ویزیت شدم و همیشه راضی بودم,1.0,topup_pref,متخصص پوست ، مو و زیبایی,5.0,0,,,1.0
task01_00202,sent_004683,اهدا کننده کلیه,0.0,topup_pref,متخصص جراحی کلیه و مجاری ادراری تناسلی ( ارولوژیست ),2.5,0,,,0.0
task01_00111,sent_004750,مادرم جراحی مهره کرده,0.0,rate_neg,فلوشیپ جراحی ستون فقرات,2.5,0,,,0.0
task01_00316,sent_004752,مشکل تنیس البوم بود ولی هنوز رفع نشده و مجبور شدم به دکتر دیگر مراجعه کنم و وقت اینترنتی اصلا زمانی نیس که ثبت میش و بیمار انتخاب می‌کند من ساعت 5 30 وقت گرفته بودم اینترنتی اما ساعت 8 نوبت من شد,-1.0,service_neg,فلوشیپ جراحی دست - آرنج ، شانه و اعصاب محیطی,2.5,0,,,-1.0
task01_00762,sent_004761,دکترخوبی است 2 بارویزیت شدم معاینات دقیق انجام می‌شود فقط معطلی زیاد داره هنوزنتیجه دلخواه 50 درصد حاصل‌شده است,0.0,high_neg,متخصص مغز و اعصاب و ستون فقرات,2.5,0,,,0.0
task01_00072,sent_004769,انسان شریف و متخصص,1.0,topup_pref,فلوشیپ جراحی ستون فقرات,2.5,0,,,1.0
task01_00069,sent_004771,برای مشکل عدم نعوظ مراجعه کردم دوماه داروخوردم اصلت نتیجه نگرفتم,-1.0,high_neg,فلوشیپ کلیه و مجاری ادراری تناسلی,2.5,0,,,-1.0
task01_00309,sent_004772,جراحی انگشت,0.0,rate_neg,جراح ارتوپد ،فلوشیپ لگن ، ران ، تعویض مفصل,2.5,0,,,0.0
task01_00040,sent_004773,امروز عمل تنگی کارپال دارم,0.0,topup_pref,جراح ارتوپد و فلوشیپ جراحی دست-شانه ،ارنج,2.5,0,,,0.0
task01_00064,sent_004802,چربی زیر پوست,0.0,random,متخصص پوست ، مو ، زیبایی و لیزر,5.0,0,,,0.0
task01_00755,sent_004810,راضی نبودم به این علت که اصلا گوش نمیکردن که من مشکلم رو بگم و مرتبا حرف خودشون رو تکرار میکردن و مشکلم حل نشد,-1.0,high_neg,متخصص زنان و زایمان,2.5,0,,,-1.0
task01_00702,sent_004849,درود همسر من مشکل پوستی داره دارو نوشتن ولی درمان نشده,-1.0,high_neg,متخصص پوست و مو,2.5,0,,,-1.0
task01_00280,sent_004851,یکبار بیشتر نرفتیم,0.0,rate_neg,فلوشیپ جراحی ستون فقرات,2.5,0,,,0.0
task01_00484,sent_004899,استرس هنوز بهتر نشدن,0.0,high_neg,متخصص مغز و اعصاب و ستون فقرات,2.5,0,,,0.0
task01_00076,sent_004928,گوش پسرم چرک داشت دارو دادند خوب شد,1.0,random,متخصص و جراح گوش و حلق و بینی,5.0,0,,,1.0
task01_00004,sent_004977,فعلا یکبار ویزیت شدم,0.0,service_neg,فلوشیپ جراحی شانه و آرنج,2.5,0,,,0.0
task01_00164,sent_004990,دکتر خوب و خوش‌برخورد معطلی در مطب برای ویزیت بسیار کم,1.0,mid_neg,متخصص زنان و زایمان,5.0,0,,,1.0
task01_00782,sent_005010,دکتر مهربون و حرفه‌ای هستن من حدود 3 ماهه برای عفونت تحت درمانم و باید همچنان ادامه بدم تا ببینم به نتیجه میرسه یا نه فقط اینکه زمان معطلی در مطب برای نوبتم همیشه خیلی زیاده و بیش از 1 ساعته,1.0,high_neg,جراح و متخصص زنان ، زایمان و نازایی,2.5,0,,,1.0
task01_00313,sent_005020,درد کتف که با تزریق و استراحت برطرف شد,0.0,topup_pref,متخصص ارتوپدی ، فلوشیپ جراحی زانو,2.5,0,,,0.0
task01_00190,sent_005109,پزشک با علم روزی هستند ولی زمان انتظار در مطب علیرغم اخذ نوبت طولانی می‌باشد,1.0,service_neg,فلوشیپ جراحی پا و مچ پا ، متخصص ارتوپدی,2.5,0,,,1.0
task01_00212,sent_005114,فعلآ در مرحله ویزیت هیتم,0.0,service_neg,فلوشیپ سرطانهای دستگاه ادراری (کرایو تراپی در مطب),2.5,0,,,0.0
task01_00737,sent_005214,خانم دکتر خوش‌برخورد بودند و با دقت به سوالات جواب می‌دادند تنها مساله این بود که ویزیت با دو ساعت معطلی از وقتی انجام شد که قبلا تعیین‌شده بود,1.0,high_neg,متخصص پوست ، مو ، زیبایی و لیزر,2.5,0,,,1.0
task01_00091,sent_005277,بسیار دکتر خوب دقیق مهربانی هستن و نوبت دهی به موقع و سر ساعت بدون مشکل,1.0,service_neg,جراح و متخصص زنان ، زایمان و نازایی,5.0,0,,,1.0
task01_00009,sent_005287,پزشک خوبی هستند ولی من درمانم رو کامل نکردم,1.0,rate_neg,متخصص مغز و اعصاب و ستون فقرات,2.5,0,,,1.0
task01_00225,sent_005317,بهترین دک,1.0,high_pos,جراح و متخصص زنان زایمان و نازایی,5.0,0,,,1.0
task01_00165,sent_005337,تا حالی آشنا نشدم ندیدم بار اولمه,0.0,rate_neg,فلوشیپ اورولوژی ترمیمی و جراحی مجاری ادراری,2.5,0,,,0.0
task01_00169,sent_005366,دکتر خوبی هستن ارامش دارن واینکه الکی سونوگرافی وهزینه اضافی برای بیمار نمیتراشن باتوجه به اینکه این هزینه‌ها الان خیلی بالا هست واقعا اگه نیاز باشه میفرسته من در دوره مراقبت بارداری هستم,1.0,mid_neg,متخصص زنان و زایمان,5.0,0,,,1.0
task01_00236,sent_005393,من پیش ایشون تزریق سلول بنیادی با کشیدن چربی از دور ناف و تزریق به زانوهام انجام دادم و فعلا یک هفته گذشته بایستی منتظر نتیجه باشم ولی در کل خوش‌اخلاق هستند و حاذق امید به خدا که تزریق من نتیجه‌بخش باشه حتما مجدد نظرم رو خواهم گفت,1.0,mixed,متخصص ارتوپدی ، جراحی استخوان ومفاصل,5.0,0,,,1.0
task01_00098,sent_005456,تنبلی تخ,0.0,rate_neg,متخصص جراحی زنان و زایمان و نازایی,2.5,0,,,0.0
task01_00268,sent_005477,فعلا تازه مراجعه کردم منتظر نتیجه هستم,0.0,high_neg,جراح و متخصص زنان زایمان نازایی,2.5,0,,,0.0
task01_00017,sent_005484,عمل کردم تحت درمانم هنوز,0.0,rate_neg,جراح کلیه، مجاری ادراری، تناسلی و پروستات ، اورولوژی,2.5,0,,,0.0
task01_00465,sent_005504,خیلی نسخه‌های گرونی تجویز میکنه و دستمزد تزریقات خیلی خیلی بالا,-1.0,high_neg,متخصص پوست ، مو ، زیبایی و لیزر,2.5,0,,,-1.0
task01_00156,sent_005506,عالی من عفونت داشتم ظرف یک هفته خوب شدم,1.0,high_pos,متخصص زنان و زایمان و نازایی,5.0,0,,,1.0
task01_00232,sent_005566,تیک چشمی فعلا اوایل هست و تشخیصی انجام‌نشده تا ببینم چی میشه در ویزیت دوم,0.0,service_neg,متخصص مغز و اعصاب (نورولوژی)، عضو انجمن صرع ایران,2.5,0,,,0.0
task01_00148,sent_005583,فقط یک‌بار ویزیت شدم برخورد ایشان مطلوب و مسوولانه بود,0.0,service_neg,جراح گوش ، حلق و بینی,2.5,0,,,0.0
task01_00205,sent_005597,اصلا ویزیت نشدم 100 تومنم دادم دیگه برگشت داده نشد,-1.0,service_neg,متخصص ارتوپدی - جراحیهای تخصصی زانو و لگن - تعویض مفصل,2.5,0,,,-1.0
task01_00166,sent_005609,با آزمایشگاه جالبی کار نمی‌کنند,0.0,rate_neg,متخصص زنان ، زایمان و نازائی,2.5,0,,,0.0
task01_00264,sent_005620,ناباروری ولی باردارنشدم,-1.0,topup_pref,متخصص زنان و زایمان,2.5,0,,,-1.0
task01_00145,sent_005652,انتظار زیاد,0.0,service_neg,متخصص اورولوژی ( جراح کلیه و مجاری ادرار ),2.5,0,,,0.0
task01_00283,sent_005691,عمل شانه راست نتیجه تازه عمل کردم معلوم نیست,0.0,rate_neg,متخصص ارتوپدی . فلوشیپ جراحی شانه و آرنج,2.5,0,,,0.0
task01_00659,sent_005706,عمل تعویض مفصل انجام دادم خوب بود اما راه رفتنم بعد از سه سال طبیعی نشده و بدون عصا خیلی بد راه میرم,-1.0,high_neg,فلوشیپ جراحی هیپ و لگن,2.5,0,,,-1.0
task01_00188,sent_005774,با بیمه قرارداد نداشتند و این نکته در رزرو نوبت اعلام‌نشده و بیمار در عمل انجام‌شده قرار می‌گیرد و ناچار به پرداخت هزینه گزاف است,-1.0,high_neg,متخصص گوش حلق بینی ، فلوشیپ جراحی گوش,2.5,0,,,-1.0
task01_00167,sent_005792,شوره سر داشتم و با اولین ویزیت درمان شدم,1.0,topup_pref,متخصص پوست و مو و زیبایی و لیزر,5.0,0,,,1.0
task01_00070,sent_005796,در حال ویزیت کردن هستم فعلا,0.0,service_neg,فلوشیپ جراحی ستون فقرات,2.5,0,,,0.0
task01_00207,sent_005797,پیچ‌خوردگی پا,0.0,topup_pref,متخصص جراحی استخوان و مفاصل ارتوپدی,2.5,0,,,0.0
task01_00071,sent_005803,من ریزش مو و جوش صورت داشتم البته جوشای صورتم زیاد نبود در حد چهار پنج تا که داروی جوش صورت خوب بود برطرف شد اما برای ریزش مو اصلا خوب نبود من ریزش موم قطع نشد,-1.0,high_neg,متخصص پوست ، مو ، زیبایی و لیزر,2.5,0,,,-1.0
task01_00180,sent_005824,در وقت دهی و مشاوره قبل از ویزیت بسیار ضعیف هستن بارها رفتم و پشت در موندم و بعد تماس وقتم رو کنسل کردم به این خاطر دیگه نمیرم باوجودی که از روند بهبود بیماریم راضیم,-1.0,high_neg,جراح و متخصص زنان و زایمان و نازایی,2.5,0,,,-1.0
task01_00184,sent_005834,خود خانم دکتر بسیار محترم و خوش‌برخورد هستن ولی منشی بعد از 4 روز از تعیین وقت زنگ زد گفت چون از سایت وقت گرفتید بین مریض حساب میشید در ضمن هزینه ویزیت رو باید نقدی حساب کنید,0.0,high_neg,متخصص زنان و زایمان و نازایی,2.5,0,,,0.0
task01_00652,sent_005872,سلام خیلی گرون حساب میکنه وحشتناک,-1.0,high_neg,متخصص جراحی استخوان و مفاصل (ارتوپدی),2.5,0,,,-1.0
task01_00011,sent_005950,نوبت دوم دکتر خوبی‌ان شا الله ک حامله بشم ده سال سابقه نازای دارم,1.0,service_neg,جراح زنان ، زایمان,2.5,0,,,1.0
task01_00276,sent_005980,خیلی شلوغ,0.0,high_neg,فلوشیپ انکولوژی زنان ، لاپاروسکوپی و کولپوسکوپی,2.5,0,,,0.0
task01_00008,sent_005995,یک نوبت ویزیت شده‌ام,0.0,service_neg,جراح کلیه مجاری ادراری پروستات و ناباروری,2.5,0,,,0.0
task01_00027,sent_006126,با دقت به حرفهای شما گوش می‌کنم و نسخه دقیق و درست هم ارائه می‌فرمایند ایشان را به دیگران معرفی و پیشنهاد می‌کنم,1.0,mid_neg,متخصص پوست ، مو ، لیزر,5.0,0,,,1.0
task01_00133,sent_006165,گرفتگی عصب دست,0.0,rate_neg,متخصص ارتوپدی ، جراح استخوان و مفاصل,2.5,0,,,0.0
task01_00131,sent_006197,دکتر با تجربه ایی بود و همانطور که فرمودن نگرانی ما درمورد راه رفتن کودکمون بی‌مورد بود و خدا رو شکر کاملا خوب شد,1.0,mid_neg,فلوشیپ ارتوپدی اطفال,5.0,0,,,1.0
task01_00146,sent_006212,قاعدگی نامنظم فعلا نتیجه نگرفتم,-1.0,high_neg,جراح و متخصص زنان و زایمان و نازایی,2.5,0,,,-1.0
task01_00079,sent_006228,بسیار عالی ولی بدیشون اینه که انتر‌ها ویزیت میکنن با دکتر نمیشه صحبت کرد,1.0,service_neg,فلوشیپ جراحی استخوان و مفاصل کودکان (ارتوپدی کودکان),2.5,0,,,1.0
task01_00193,sent_006230,سلام من قبلاویزیت شدم کارش عالی هستش,1.0,topup_pref,متخصص گوش حلق و بینی,5.0,1,,,1.0
task01_00052,sent_006236,مطبشون شلوغه اما دکتر و پرسنل بشدت عالی هستن,1.0,mixed,متخصص پوست ، مو ، زیبایی و لیزر,5.0,0,,,1.0
task01_00022,sent_006282,مشکل جوش داشتم که در حال درمانم هنوز نمیتونم نظر قطعی بدم,0.0,rate_neg,متخصص پوست ، مو ، زیبایی و لیزر,2.5,0,,,0.0
task01_00706,sent_006286,در طاهر موجه اما دنبال هزینه تراشیدن زیاد برای بیماران نااگاه سهرستانی در کلینیک میر است,-1.0,high_neg,متخصص جراحی استخوان و مفاصل (ارتوپدی),2.5,0,,,-1.0
task01_00037,sent_006321,تشخیص ایشون خوب بود ولی کرمی که نوشتن فوق‌العاده گران بود چون دست‌ساز نوشته بودن می‌شد با یک کرم ساده که در داروخانه‌ها هست کار را جمع کرد من کرم آماده داروخانه را گرفتم برای رفع لک,0.0,high_neg,متخصص پوست و مو (درماتولوژی),2.5,0,,,0.0
task01_00106,sent_006367,خیلی معطلی داره اگه یکم به فکر مراجعین باشند بد نیست تو این زمونه 4 ساعت تو نوبت بشینی با اینکه از قبل وقت گرفتی قابل توجیه نیست,-1.0,high_neg,فلوشیپ ارتوپدی و جراحی ستون فقرات,2.5,0,,,-1.0
task01_00054,sent_006431,برای اولین بار به خانم دکتر مراجعه کردم,0.0,topup_pref,متخصص زنان و زایمان - فلوشیپ نازایی,2.5,0,,,0.0
task01_00256,sent_006443,من یک‌دفعه ویزیت شدم ولی برخورد بسیار عالی داشتند,1.0,topup_pref,متخصص ارتوپدی - جراح زانو و هیپ,5.0,0,,,1.0
task01_00210,sent_006463,برای دیدن دکتر هفت خوان رد می‌کنی بعدم بنظرم کارهایی انجام میشه که بیشتر بخاطر گرفتن هزینه از بیمارهاست,-1.0,high_neg,جراح و متخصص استخوان و مفاصل (ارتوپد),2.5,0,,,-1.0
task01_00159,sent_006468,می‌شناسم دکتر مورد قبول لرای جراحی میباسد,1.0,rate_neg,متخصص جراحی استخوان و مفاصل (ارتوپدی),2.5,0,,,1.0
task01_00600,sent_006476,برای ویزیت مبلغ بیشتری از تعرفه مصوب دریافت کردن و گفتن برای تشکیل پرونده که اصلا منطقی نیست با حوصله بودن ولی هنوز زمان مصرف داروهام نرسیده,1.0,service_neg,جراح و متخصص زنان و زایمان و نازایی,2.5,0,,,1.0
task01_00293,sent_006478,نارسایی کلیه درمان,0.0,random,متخصص اورولوژی - فلوشیپ اندویورولوژی و لاپاراسکوپی,5.0,0,,,0.0
task01_00228,sent_006489,سلام بنده مشکل خشکی و اگزما پوستی داشتم که با ویزیت دکتر بزرگوار در متر از یک هفته بهبودی حاصل شد,1.0,topup_pref,متخصص پوست و مو و زیبایی,5.0,0,,,1.0
task01_00214,sent_006493,سلام ماه دوم باردارم لکه بینی صورتی دارم چندروز یک‌بار خیلی نگرانم بعداز 6 سال حامله شدم توراخدا رانمایم کن چکارکنم,0.0,mid_neg,جراح و متخصص زنان و زایمان ، نازایی,5.0,0,,,0.0
task01_00527,sent_006508,ایشان بسیار بی‌حوصله هستند و بیماران را همیشه منتظر خود می‌گذارند و اگر بیمار سوال می‌پرسد ایشان می‌گویند از منشی بپرسید,-1.0,high_neg,متخصص ارتوپدی ( جراح استخوان و مفاصل ),2.5,1,,,-1.0
task01_00130,sent_006515,دکتر خوشرو و به نظر با سواد میاد خیلی وقت میذارن برای بیمار در واقع زیادی وقت میذارن و همین باعث شد من 4 ساعت منتظر بمونم فعلا دارم میرم جلو و نتیجه درمان مشخص بشه میتونم نظر نهایی رو در مورد تشخیص ایشون بدم,1.0,service_neg,جراح و متخصص ارتوپدی,5.0,0,,,1.0
task01_00644,sent_006554,تاخیر در پریود تحت درمان هستم,0.0,high_neg,جراح و متخصص زنان و زایمان و نازایی,2.5,0,,,0.0
task01_00253,sent_006569,سلام خوب بودند,0.0,rate_neg,متخصص مغز و اعصاب (نورولوژی)، عضو انجمن صرع ایران,2.5,0,,,0.0
task01_00038,sent_006594,من کاشت مو انجام دادم پیش شما و خیلی راضی‌ام ممنون از خانم دکتر یزدانی و تیم حرفه‌ای ایشون,1.0,mixed,متخصص پوست ، مو ، زیبایی,5.0,0,,,1.0
task01_00041,sent_006620,مشکل تاخیر در قائدگی داشتم,1.0,mid_neg,جراح و متخصص زنان ، زایمان و فلوشیپ ناباروری,5.0,0,,,1.0
task01_00162,sent_006644,اسپاسم شدید پای دخترم خوب بودن,1.0,rate_neg,متخصص جراحی استخوان و مفاصل ( ارتوپدی ),2.5,0,,,1.0
task01_00143,sent_006652,باعرض سلام من محمدرضا آزادی هستم هفت بهمن عمل رباط صلیبی و منیسک پای راستم پیش دکتر شهرستانی انجام دادم کرمانشاه زندگی می‌کنم توی شهر خودم حقیقت به هیچ پزشکی اعتماد نداشتم اما من عملهای دکتر شهرستانی هم ازاینستاگرام دیدم و هم توی مطب باهاشان صحبت کردم خوشبختانه بارضایت کامل رفتم پیش دکتر وعمل پام انجام داد خدا رو شکر الان حدودپنج هفته از عملم میگذره خوب خوبم واز دکتر تشکر ویژه دارم خدا بهت سلامتی وعزت بده,1.0,service_neg,متخصص جراحی استخوان و مفاصل(ارتوپد),5.0,0,,,1.0
task01_00291,sent_006692,فعلا تحت درمان هستم نظری نمیتونم بدم,0.0,rate_neg,جراح گوش ، حلق و بینی,2.5,0,,,0.0
task01_00218,sent_006697,در زمان جنگ پیش خانم دکتر رفتم برای آمینوسنتز خیلی نگران بودم بخاطر اینکه تمامی مراکز بسته بودند ولی دکتر محرابی حضور داشتند باعث دلگرمی من شدند کارم و با دقت انجام دادند مطب شون محیطی آرام و پرسنل خوب و مهربان که باعث آرامشم شدند و هیچ وقت فراموش نمی‌کنم,1.0,mid_neg,فلوشیپ طب مادر و جنین (پریناتولوژی),5.0,0,,,1.0
task01_00247,sent_006701,عفونت مزمن چندین ساله داشتم که به لطف درمان ایشان خوب شدم با آرامش و دانا و انسانی بزرگوار,1.0,high_pos,جراح و متخصص زنان و زایمان,5.0,0,,,1.0
task01_00046,sent_006719,برای گوش رفتم دکتر خوبی هستن فقط نوبت دهی ضعیفی,0.0,service_neg,جراح گوش و حلق و بینی,2.5,0,,,0.0
task01_00108,sent_006732,بسیار حاذق و دقیق هستن خانم دکتر شفیعیان کمک بزرگی کردن به من وقتی‌که از لحاظ جسمی و روحی شرایط خیلی بدی داشتم تا همیشه ممنونم از لطف و مهربانیشون,1.0,mixed,جراح و متخصص زنان و زایمان ، نازایی,5.0,0,,,1.0
task01_00303,sent_006740,تشخیصشان خوب بود,1.0,rate_neg,متخصص مغز و اعصاب و ستون فقرات,2.5,0,,,1.0
task01_00686,sent_006747,سلام من دارو استفاده کردم تا الان هیچ تغییری نکردم هنوز کمر درد رو دارم,-1.0,high_neg,فلوشیپ ستون فقرات و توانبخشی ، متخصص طب فیزیکی,2.5,0,,,-1.0
task01_00158,sent_006761,فقط ویزیت شدم دیگه کارشو ندیدم,0.0,topup_pref,متخصص و جراح پوست ، مو و زیبایی و لیزردرمانی,5.0,0,,,0.0
task01_00042,sent_006776,دقیق با سواد و صبور ومحترم مطب تمیز و منشی بسیار مهربان,0.0,topup_pref,متخصص مغز و اعصاب ( نورولوژی ),5.0,0,,,0.0
task01_00450,sent_006787,دستم پارگی شدید نداشته ایشون پی از پی انجام دادن بهتر که نشدم بدتر هم شدم فقط کلی هزینه کردم,-1.0,high_neg,متخصص ارتوپدی و جراحی مفاصل و استخوان,2.5,0,,,-1.0
task01_00295,sent_006790,فعلا منتظرتونم آزمایش هستیم,0.0,high_neg,متخصص و جراح زنان و زایمان و نازایی,2.5,0,,,0.0
task01_00057,sent_006800,اولین دکتر پوستی بودن که برای من آزمایش هورمونی نوشتن اصلا کرم‌های گرون و الکی تجویز نمیکنن و خیلی به فکر بیمار هستن,1.0,mid_neg,متخصص بیماریهای پوست و مو و لیزر,5.0,0,,,1.0
task01_00084,sent_006840,جوش نوجوانی دخترم,0.0,rate_neg,متخصص پوست و مو,2.5,0,,,0.0
task01_00315,sent_006859,پزشک با اخلاق,1.0,topup_pref,جراح مغز و اعصاب و ستون فقرات,2.5,0,,,1.0
task01_00224,sent_006886,استرس واظطراب وحال خیلی بد الان 3 ساله تحت نظر ایشون هستم وخیلی راضیم,1.0,high_neg,متخصص مغز و اعصاب (نورولوژیست),5.0,0,,,1.0
task01_00110,sent_006892,گوش‌درد و تحت درمان,0.0,rate_neg,جراح و متخصص گوش و حلق و بینی,2.5,0,,,0.0
task01_00080,sent_006908,فعلا جهت تشخیص اقدامات پاراکلنیکی دارم انجام می‌دم,0.0,rate_neg,متخصص مغز و اعصاب و ستون فقرات,2.5,0,,,0.0
task01_00129,sent_006913,مشکل دست عمل کردن خوب بود,0.0,rate_neg,جراح و متخصص ارتوپدی - فلوشیپ جراحی دست,2.5,0,,,0.0
task01_00242,sent_006914,خیلی دکتر مهربون و خوش‌اخلاق بیمار آروم میکنن بدون هیچ وارد کردن استرسی مطبشون مکانی کاملا آروم با پرسنلی کاملا محترم,1.0,service_neg,متخصص زنان و زایمان,5.0,0,,,1.0
task01_00086,sent_006954,برای درمان ناباروری مراجعه کردم و یک ماه هنوز نتیجه نگرفتم ولی دکتر خیلی خوبی هستند خوش‌اخلاق و مهربون,0.0,mid_neg,متخصص و جراح زنان و زایمان ، نازایی - دارای بورد تخصصی,5.0,0,,,0.0
task01_00073,sent_006964,نوار عصب همانجا انجام می‌شود بسیار عالی,1.0,high_pos,متخصص مغز و اعصاب و ستون فقرات,5.0,0,,,1.0
task01_00477,sent_007009,منتظرم جواب آزمایش ببرم پیشش,0.0,high_neg,جراح و متخصص زنان ، زایمان,2.5,0,,,0.0
task01_00248,sent_007013,سردرد داشتم,0.0,random,متخصص مغز و اعصاب (نورولوژی)، عضو انجمن صرع ایران,5.0,0,,,0.0
