task_id,item_id,text_label,label_human,bucket,specialty,rate,is_duplicate,label_human_note,rater_id,label_human_int
task01_00282,sent_007018,اخلاق خیلی خوب صبر و متانت در برخورد با بیمار گوش دادن به صحبت‌های بیمار از بهترین ویژگی‌های آقای دکتر هستش,1.0,high_pos,متخصص مغز و اعصاب (نورولوژی),5.0,0,,,1.0
task01_00300,sent_007020,بسیار دکتر خوش‌برخورد و محترمی هستن علاوه بر اینکه کامل مشکل رو گوش میکنن و به همه سوالات جواب میدن در مورد علت مشکل و راه‌های درمان هم خیلی مفصل توضیح میدن آنتایم بودنشون و بدون معطلی هم واقعا ویژگی مهمی برای منه من مشکل خونریزی بینی داشتم که با تجویز چند کرم و پماد ایشون الحمدلله 3 4 روزه برطرف شد,1.0,service_neg,جراح و متخصص گوش و حلق و بینی,5.0,0,,,1.0
task01_00304,sent_007065,با توجه به تجربیات بد گذشتهام در مطب‌های دیگر متخصص زنان باید بگم که خیلی حس خوبی داشتم خانم دکتر خیلی آرام و واقعا متخصص هستند از رفتار و احترامشون مچکرم,1.0,service_neg,متخصص زنان و زایمان,5.0,1,,,1.0
task01_00137,sent_007068,برای لوزه هام رفتم قرص دادند بر طرف شد ولی چند ماه باید قرص مصرف کنم و در صورتی که خوب نشد عمل انجام میدن,0.0,topup_pref,متخصص گوش و حلق و بینی,2.5,0,,,0.0
task01_00139,sent_007077,درد دست هنوز یکباررفتم,0.0,rate_neg,فلوشیپ جراحی شانه و آرنج,2.5,1,,,0.0
task01_00233,sent_007129,بهترینن در کارشون,1.0,high_pos,متخصص پوست و مو,5.0,0,,,1.0
task01_00220,sent_007159,خوبه ولی نوبت خیلی مطب بی نظمی دارن منشی‌ها اشنا هارو زود‌تر میفرستن داخل,0.0,service_neg,متخصص جراحی استخوان و مفاصل ارتوپدی,2.5,0,,,0.0
task01_00003,sent_007182,در دست اقدام می‌باشد,0.0,rate_neg,متخصص پوست و مو,2.5,0,,,0.0
task01_00296,sent_007213,در حالل ررسی است,0.0,topup_pref,متخصص زنان ، زایمان نازایی,2.5,0,,,0.0
task01_00050,sent_007220,برای دیسک کمر و گردن رفتم بعد از دیدن‌ام ار‌ای گفتن مشکل خاصی نداری زمان معاینه یجوری رگ سیاتیکمو فشار دادن که تا چند روز یطرفم درد می‌کرد,0.0,rate_neg,متخصص مغز و اعصاب و ستون فقرات,2.5,0,,,0.0
task01_00114,sent_007247,ابشون بسیار با حوصله با بیمار رفتار میکنن وتشخیص شون درست وبرای بیمار هزینه تراشی بی‌مورد نمیکنن,1.0,mid_neg,جراح و متخصص ارتوپدی,5.0,0,,,1.0
task01_00245,sent_007282,پسرم مشکل حنجره داشت ک باید لیزر می‌شد قبل از ایشون پیش چند تا دکتر بردم لیزر شد ولی هیچ تغییری نکرد ولی با اولین لیزرایشون پسرم خیلی بهتر شد خدا خیرش بده,1.0,mixed,فلوشیپ حنجره ، گوش و حلق و بینی,5.0,0,,,1.0
task01_00266,sent_007301,3 بار مراجعه کردم و نتیجه نگرفتم داره زمین گیرم میکنه 35 سالمه,-1.0,high_neg,متخصص جراحی استخوان و مفاصل(ارتوپد),2.5,0,,,-1.0
task01_00127,sent_007327,من مادرم وضیت خیلی بدی داشت زانو درد شدید هرشب با گریه‌های مادرم از خواب بیدار می‌شدم زندگیم کابوس شده بود و زجه‌های مادرم دکتر شهرستانی معجزه خدا بود برای زندگی ما مادرم بعد عمل پاش عالی شد مادرم توانایی راه رفتن رو دوباره به دست اورد دکتر شهرستانی ممنونتم واقعا ممنونتونم که با خوشرویی تمام با مریضاتون برخورد می‌کنی و امید زندگی رو بهمون میدین واقعا یه دونه‌ای,1.0,mixed,متخصص جراحی استخوان و مفاصل(ارتوپد),5.0,0,,,1.0
task01_00122,sent_007331,بعد عمل خیلی می‌ترسیدم که فایده نداشته باشه اما الان 2 ماه گذشته و من ورزش هم می‌کنم,1.0,mid_neg,فلوشیب زانو و آسیبهای ورزشی شانه و زانو,5.0,0,,,1.0
task01_00281,sent_007335,هنوز مشخص نیست,0.0,rate_neg,متخصص ارتوپدی و فلوشیپ جراحی زانو,2.5,0,,,0.0
task01_00277,sent_007343,توصیه به کاشت مو,0.0,high_neg,متخصص پوست و مو,2.5,0,,,0.0
task01_00015,sent_007348,لکه پوستی و جوش,0.0,rate_neg,متخصص پوست ، مو ، زیبایی و لیزر,2.5,0,,,0.0
task01_00208,sent_007370,بسیار عالی بودند تنها نقطه‌ضعف معطلی بسیار زیاد در مطب است,1.0,mixed,متخصص پوست ، مو ، زیبایی و لیزر,5.0,0,,,1.0
task01_00118,sent_007405,پسر بنده پیش دکتر دیگری ختنه‌کرده بودن و نگرانی‌هایی داشتم پیش آقآی دکتر رفتیم معاینه کردن و با وجدان کاری و روی خوش‌خیال ما رو راحت کردن که مشکلی نداره بهترین دکتر از نظر تخصص و اخلاق پزشکی ایشون رو دیدم خدا حفظشون کنه,1.0,mixed,متخصص جراحی کلیه و مجاری ادراری,5.0,0,,,1.0
task01_00318,sent_007415,برای آسیب عصب سیاتیک مراجعه کردم و راضی نبودم,-1.0,high_neg,متخصص جراحی مغز و اعصاب دیسک و ستون فقرات,2.5,0,,,-1.0
task01_00305,sent_007466,من بیمار دکتر فرحناد بودم بخاطر برخورد بسیار بد منشی رفتم مطب دکتر نیکفرجام برخورد منشیشون اینقدر خوب و دلنشین بود که کلا دیگه میرم زیر نظر دکتر نیکفرجام واقعا مثل منشیشون کم هست خدا حفظشون کنه,1.0,service_neg,متخصص زنان زایمان و نازایی,5.0,0,,,1.0
task01_00298,sent_007502,مشکل سردرد هنوز چیزی معلوم نیست,0.0,rate_neg,متخصص مغز و اعصاب و ستون فقرات,2.5,0,,,0.0
task01_00299,sent_007525,تعریف یا واژه بهتر ایشان دست شفا از طرف خدا برای بیمارهایش هست من از دیگران متخصص بودنش را شنیده‌ام,1.0,mixed,متخصص جراحی مغز و اعصاب,5.0,0,,,1.0
task01_00508,sent_007528,پزشکان امروزه به دید مشتری به بیمار نگاه می‌کنند واین جای تاسف زیادی داره دراولین مراجعه من بدون اینکه درخواستی داده باشم ازمن سنو گرفتند و 3 400 هزینه ویزیت وسنو شد واقعا شوک شدم ازاینهمه بی عدالتی,-1.0,high_neg,جراح و متخصص زنان ، زایمان و فلوشیپ ناباروری,2.5,0,,,-1.0
task01_00756,sent_007535,بله prp انجام دادم هنوز کامل نتیجه نگرفتم چون درمان ادامه داره امیدوارم بعدا رضایت داشته باشم,0.0,high_neg,متخصص و جراح پوست ، زیبایی و لیزر,2.5,0,,,0.0
task01_00844,sent_007563,مطب بسیار شلوغه و نوبت دهی بر اساس وقت‌های تعیین‌شده در سایت نیست,-1.0,high_neg,متخصص پوست ، مو ، زیبایی و لیزر,2.5,0,,,-1.0
task01_00805,sent_007608,عمل ستون فقرات داشتم فعلا نمی‌توانم چیزی بگویم منتظر زمانم,0.0,high_neg,فلوشیپ جراحی ستون فقرات و متخصص ارتوپدی,2.5,0,,,0.0
task01_00297,sent_007630,دکتر خوب وخوش اخلاق و تجربیات خیلی زیادی داشتن نسبت به دکترهای دیگه که در حد چند دقیقه معمولی چک می‌کنن,1.0,rate_neg,فلوشیپ ناباروری,2.5,0,,,1.0
task01_00216,sent_007672,حالم خیلی بد بود تا حدی که می‌خواستم خودکشی کنم و به کارهای خونه و بچه‌ها نمیتونستم برسم ولی الان خیلی بهترم,1.0,high_neg,متخصص مغز و اعصاب ( نورولوژی ),5.0,0,,,1.0
task01_00140,sent_007683,جوش صورت و درمان شد و دخترم زخم صورت و با کمترین هزینه درمان شد,1.0,mid_neg,متخصص پوست و مو,5.0,0,,,1.0
task01_00793,sent_007694,مطب بسیار شلوغ ساعت انتظار طولانی,-1.0,high_neg,متخصص ارتوپدی فلوشیپ جراحی زانو,2.5,0,,,-1.0
task01_00271,sent_007717,فعلا هنوز‌ام ار‌ای دادند,0.0,topup_pref,فلوشیپ جراحی شانه و آرنج,2.5,0,,,0.0
task01_00284,sent_007767,مراقبت قبل از بارداری و خوب بود,1.0,rate_neg,جراح و متخصص زنان و زایمان و نازایی,2.5,0,,,1.0
task01_00290,sent_007808,اصلا جواب تلفن نمیدن چهار روز دارم مدام زنگ می‌زنم,-1.0,service_neg,فلوشیپ جراحی زانو,2.5,0,,,-1.0
task01_00123,sent_007834,سلام من رفتم مطب دکتر علیزاده نبود دکتر صالح حبیبی بود وقت میزاره برا بیمار که حرف بزنه وتشخیص دقیق داد نتیجه گرفتم خیلی ممنونم ازش خدا خیرش بده,1.0,service_neg,متخصص و جراح گوش و حلق و بینی و سر و گردن,5.0,0,,,1.0
task01_00163,sent_007835,برای لوزه دخترم نوبت عمل دادن برخورد و توضیحات خیلی خوب بود,1.0,topup_pref,متخصص گوش و حلق و بینی,5.0,0,,,1.0
task01_00287,sent_007862,سردرد‌های حمله‌ای و شدید دخترم باعث شد از کاشان به حضور ایشان بیام از نسخه اول بسیار راضی هستم,1.0,mid_neg,فوق تخصص مغز و اعصاب کودکان ، استاد دانشگاه,5.0,0,,,1.0
task01_00255,sent_007882,پسرم لوزه داشت و دکتر با دارو درمان کرد,0.0,topup_pref,جراح گوش ، حلق و بینی,2.5,0,,,0.0
task01_00036,sent_007892,فعلا در حال ویزیت هستم,1.0,topup_pref,جراح و متخصص استخوان و مفاصل (ارتوپد),5.0,0,,,1.0
task01_00153,sent_007914,مطب بسیار شلوغ بود,0.0,high_neg,جراح و متخصص زنان ، زایمان و نازایی,2.5,0,,,0.0
task01_00001,sent_007920,درد شدید کمر,0.0,topup_pref,جراح مغز و اعصاب و ستون فقرات,2.5,0,,,0.0
task01_00051,sent_007929,بثورات پوستی دوتا دکتر تشخیص اشتباه دادن ایشون تشخیص ویروس دادن و گفتن خودش خوب میشه و رو به بهبودم هستم,1.0,high_neg,متخصص پوست و مو ، زیبایی و لیزر,5.0,0,,,1.0
task01_00261,sent_007933,جراحی دیسک فعلا نتیجه نگرفتم,0.0,mid_neg,فلوشیپ جراحی ستون فقرات,5.0,0,,,0.0
task01_00178,sent_007957,برای اقدام به بارداری,0.0,topup_pref,متخصص زنان و زایمان ( فلوشیپ نازایی )، IVF و لاپاراسکوپی,2.5,0,,,0.0
